doi,cited_by_count,publication_year,title,n_pages,found_on_wiki
10.1177/0956797616639727,369,2016,Parents’ Views of Failure Predict Children’s Fixed and Growth Intelligence Mind-Sets,1,TRUE
10.1016/j.jesp.2008.03.012,369,2008,Judging near and distant virtue and vice,0,FALSE
10.1086/383422,368,2004,A Sound Idea: Phonetic Effects of Brand Names on Consumer Judgments,0,FALSE
10.1177/0956797611428079,368,2012,Can an Agentic Black Woman Get Ahead? The Impact of Race and Interpersonal Dominance on Perceptions of Female Leaders,1,TRUE
10.1177/0956797611398497,367,2011,A Bad Taste in the Mouth,0,FALSE
10.1002/smj.774,367,2009,Structural homophily or social asymmetry? The formation of alliances by poorly embedded firms,0,FALSE
10.1073/pnas.1217854110,360,2013,Normalization is a general neural mechanism for context-dependent decision making,1,TRUE
10.3758/bf03193824,358,2006,It’s under control: Top-down search strategies can override attentional capture,0,FALSE
10.1111/j.1467-9280.2008.02100.x,357,2008,“In-Group Love” and “Out-Group Hate” as Motives for Individual Participation in Intergroup Conflict,1,TRUE
10.1037/0096-1523.15.4.673,357,1989,Saccade preparation inhibits reorienting to recently attended locations.,1,TRUE
10.1111/j.1467-9280.2008.02053.x,356,2008,Errors Are Aversive,1,TRUE
10.5334/joc.91,356,2020,Good News about Bad News: Gamified Inoculation Boosts Confidence and Cognitive Immunity Against Fake News,1,TRUE
10.1177/0146167205284004,355,2006,Reducing Automatically Activated Racial Prejudice Through Implicit Evaluative Conditioning,0,FALSE
10.1007/s10940-015-9263-8,354,2015,Is the Effect of Procedural Justice on Police Legitimacy Invariant? Testing the Generality of Procedural Justice and Competing Antecedents of Legitimacy,0,FALSE
10.1145/1404520.1404531,354,2008,"Relationships between reading, tracing and writing skills in introductory programming",1,TRUE
10.1037/0022-3514.94.3.516,353,2008,The nonverbal expression of pride: Evidence for cross-cultural recognition.,1,TRUE
10.1126/science.1195701,352,2010,Thought for Food: Imagined Consumption Reduces Actual Consumption,1,TRUE
10.1257/aer.102.2.720,351,2013,Slow to Anger and Fast to Forgive: Cooperation in an Uncertain World,1,TRUE
10.1037/0022-3514.67.3.357,350,1994,The temporal pattern to the experience of regret.,0,FALSE
10.1126/science.1183532,349,2010,Lab Experiments for the Study of Social-Ecological Systems,0,FALSE
10.1371/journal.pgen.1000847,348,2010,A Genome-Wide Association Study Identifies Susceptibility Variants for Type 2 Diabetes in Han Chinese,0,FALSE
10.2307/1961661,348,1989,Macropartisanship,0,FALSE
10.1086/668417,348,2013,Overdoing Gender: A Test of the Masculine Overcompensation Thesis,0,FALSE
10.1016/j.jue.2008.02.004,348,2008,Discrimination in the rental housing market: A field experiment on the Internet,1,TRUE
10.1086/669122,346,2013,Educational Systems and the Trade-Off between Labor Market Allocation and Equality of Educational Opportunity,0,FALSE
10.1037/0022-3514.95.1.76,345,2008,The rejection of moral rebels: Resenting those who do the right thing.,1,TRUE
10.1111/j.1467-7687.2009.00807.x,345,2009,Differences in the neural mechanisms of selective attention in children from different socioeconomic backgrounds: an event‐related brain potential study,0,FALSE
10.1017/s0305000900012411,345,1988,Vocabulary simplification for children: a special case of ‘motherese’?,0,FALSE
10.1016/j.biopsych.2005.07.040,344,2005,Detecting Deception Using Functional Magnetic Resonance Imaging,0,FALSE
10.5840/jphil20091061128,343,2009,Cause and Norm,0,FALSE
10.1073/pnas.1209746109,343,2012,RETRACTED: Signing at the beginning makes ethics salient and decreases dishonest self-reports in comparison to signing at the end,1,TRUE
10.1017/s0272263109990519,342,2010,EFFECTS OF FORM-FOCUSED PRACTICE AND FEEDBACK ON CHINESE EFL LEARNERS’ ACQUISITION OF REGULAR AND IRREGULAR PAST TENSE FORMS,0,FALSE
10.4324/9781032633275-7,341,2024,Studies of Similarity,0,FALSE
10.1111/j.1467-9280.2008.02054.x,339,2008,The Face of Success,0,FALSE
10.1001/jamapsychiatry.2014.763,338,2014,Subtyping Attention-Deficit/Hyperactivity Disorder Using Temperament Dimensions,0,FALSE
10.1038/ng2101,337,2007,A genome-wide association scan identifies the hepatic cholesterol transporter ABCG8 as a susceptibility factor for human gallstone disease,0,FALSE
10.1016/j.jecp.2012.06.013,336,2012,"Executive functions and inhibitory control in multilingual children: Evidence from second-language learners, bilinguals, and trilinguals",0,FALSE
10.1037/0022-3514.74.1.53,335,1998,The disparity between the actual and assumed power of self-interest.,2,TRUE
10.1080/00223891.2013.806327,335,2013,"Openness to Experience, Intellect, and Cognitive Ability",0,FALSE
10.1111/j.1467-9280.2008.02136.x,334,2008,Measuring the Crowd Within,2,TRUE
10.1257/aer.101.2.526,333,2011,"The Economics of Credence Goods: An Experiment on the Role of Liability, Verifiability, Reputation, and Competition",2,TRUE
10.1038/sj.mp.4001437,333,2004,Molecular characterization of bipolar disorder by comparing gene expression profiles of postmortem brains of major mental disorders,2,TRUE
10.3758/bf03206733,332,1994,Absolute memory for musical pitch: Evidence from the production of learned melodies,2,TRUE
10.1111/j.1467-9280.2008.02077.x,331,2008,"Toward a Physiology of Dual-Process Reasoning and Judgment: Lemonade, Willpower, and Expensive Rule-Based Analysis",1,TRUE
10.1126/science.1253932,331,2014,Avoiding overhead aversion in charity,3,TRUE
10.1038/ng.3246,331,2015,Loss-of-function variants in ABCA7 confer risk of Alzheimer's disease,1,TRUE
10.1037/0022-3514.82.5.792,329,2002,"It feels like yesterday: Self-esteem, valence of personal past experiences, and judgments of subjective distance.",1,TRUE
10.1038/s41593-021-00908-3,328,2021,Multivariate analysis of 1.5 million people identifies genetic associations with traits related to self-regulation and addiction,0,FALSE
10.1093/qje/qjr034,327,2011,Expectations as Endowments: Evidence on Reference-Dependent Preferences from Exchange and Valuation Experiments *,0,FALSE
10.2501/jar-40-1-2-29-34,323,2000,Webpage Background and Viewer Attitudes,0,FALSE
10.1126/science.aau8712,323,2019,Civic honesty around the globe,0,FALSE
10.1016/j.cell.2008.05.048,321,2008,"A Polymorphism in CALHM1 Influences Ca2+ Homeostasis, Aβ Levels, and Alzheimer's Disease Risk",1,TRUE
10.1016/j.jml.2013.08.001,321,2013,Bilinguals reading in their second language do not predict upcoming words as native readers do,0,FALSE
10.2753/jec1086-4415130103,319,2008,Elucidating Individual Intention to Use Interactive Information Technologies: The Role of Network Externalities,0,FALSE
10.1016/j.cognition.2010.09.012,319,2010,Fortune favors the ( ): Effects of disfluency on educational outcomes,2,TRUE
10.1037/h0053944,318,1946,Studies in spatial learning. I. Orientation and the short-cut.,0,FALSE
10.1016/j.jml.2007.02.001,317,2007,"The tug of war between phonological, semantic and shape information in language-mediated visual search",0,FALSE
10.1111/j.1467-7687.2005.00441.x,317,2005,Fast mapping between a phrasal form and meaning,0,FALSE
10.1177/002224298204600109,317,1982,The Effects of Music in Advertising on Choice Behavior: A Classical Conditioning Approach,0,FALSE
10.2307/2586119,317,1999,Negative Campaign Advertising: Demobilizer or Mobilizer?,0,FALSE
10.1093/acprof:oso/9780190205782.001.0001,315,2016,Populist Authoritarianism,1,TRUE
10.1111/j.1551-6709.2009.01092.x,312,2010,The Effects of Feature‐Label‐Order and Their Implications for Symbolic Learning,0,FALSE
10.1177/0956797614534693,311,2014,Free Will and Punishment: A Mechanistic View of Human Nature Reduces Retribution,0,FALSE
10.1111/j.1467-9280.2008.02064.x,310,2008,Adaptive Memory,0,FALSE
10.1016/j.neuron.2008.07.005,310,2008,Subliminal Instrumental Conditioning Demonstrated in the Human Brain,0,FALSE
10.1073/pnas.1211645109,309,2012,Reading and doing arithmetic nonconsciously,0,FALSE
10.1093/qje/qjt035,308,2013,“Last-Place Aversion”: Evidence and Redistributive Implications *,0,FALSE
10.1038/nn.3973,307,2015,Retrieval induces adaptive forgetting of competing memories via cortical pattern suppression,0,FALSE
10.1038/nature12774,306,2013,Experimental evidence for the influence of group size on cultural complexity,0,FALSE
10.1053/j.gastro.2014.04.022,305,2014,Genome-Wide Association Study Identifies Variants Associated With Autoimmune Hepatitis Type 1,0,FALSE
10.1037/0278-7393.34.2.302,299,2008,How does bilingualism improve executive control? A comparison of active and reactive inhibition mechanisms.,0,FALSE
10.1080/03634520109379232,296,2001,"The relationship of teacher clarity and immediacy with student state receiver apprehension, affect, and cognitive learning",0,FALSE
10.2196/20572,296,2020,Adoption of a Contact Tracing App for Containing COVID-19: A Health Belief Model Approach,0,FALSE
10.1037/0096-3445.130.3.427,296,2001,"I am not an animal: Mortality salience, disgust, and the denial of human creatureliness.",1,TRUE
10.1037/0278-7393.34.3.514,294,2008,The Stroop effect: Why proportion congruent has nothing to do with congruency and everything to do with contingency.,0,FALSE
10.1093/brain/awq035,294,2010,Cerebrospinal fluid chitinase 3-like 1 levels are associated with conversion to multiple sclerosis,0,FALSE
10.1037/a0030655,294,2012,When cheating would make you a cheater: Implicating the self prevents unethical behavior.,0,FALSE
10.1111/j.1467-8624.2009.01278.x,294,2009,The Development of Regulatory Functions From Birth to 5 Years: Insights From Premature Infants,0,FALSE
10.1016/j.worlddev.2011.05.014,293,2011,Does Foreign Direct Investment Reduce Poverty in Africa and are There Regional Differences?,0,FALSE
10.1111/j.0956-7976.2005.00810.x,293,2005,Victim Derogation and Victim Enhancement as Alternate Routes to System Justification,1,TRUE
10.1037/0022-3514.90.2.197,292,2006,Temporal differences in trait self-ascription: When the self is seen as an other.,3,TRUE
10.1037/0022-3514.94.2.183,292,2008,Dynamics of self-regulation: How (un)accomplished goal actions affect motivation.,0,FALSE
10.1073/pnas.1423035112,291,2015,The collaborative roots of corruption,0,FALSE
10.1073/pnas.1511536112,290,2015,High economic inequality leads higher-income individuals to be less generous,1,TRUE
10.3389/fpsyg.2014.01202,290,2014,A mind you can count on: validating breath counting as a behavioral measure of mindfulness,0,FALSE
10.1037/xge0000182,290,2016,Separate but correlated: The latent structure of space and mathematics across development.,0,FALSE
10.1016/j.jesp.2015.01.005,290,2015,Americans overestimate social class mobility,3,TRUE
10.1016/j.obhdp.2010.10.001,288,2010,Cheating more when the spoils are split,0,FALSE
10.1086/648381,288,2009,"Believe Me, I Have No Idea What I’m Talking About: The Effects of Source Certainty on Consumer Involvement and Persuasion",0,FALSE
10.1111/j.1467-9280.2008.02041.x,286,2008,Action Dynamics Reveal Parallel Competition in Decision Making,2,TRUE
10.1056/nejmoa1007064,285,2010,E2-2 Protein and Fuchs's Corneal Dystrophy,0,FALSE
10.1016/0749-596x(88)90071-x,285,1988,Cognitive penetration of the mechanisms of perception: Compensation for coarticulation of lexically restored phonemes,0,FALSE
10.1093/jcr/ucv048,283,2015,On the Psychology of Scarcity: When Reminders of Resource Scarcity Promote Selfish (and Generous) Behavior,0,FALSE
10.1126/science.1211180,283,2012,Affirmative Action Policies Promote Women and Do Not Harm Efficiency in the Laboratory,0,FALSE
10.1037/pspi0000109,282,2017,Awe and humility.,0,FALSE
10.1257/aer.103.4.1325,282,2013,The Lure of Authority: Motivation and Incentive Effects of Power,0,FALSE
10.1038/ng.635,282,2010,Genome-wide association study identifies five new susceptibility loci for prostate cancer in the Japanese population,1,TRUE
10.1093/jcr/ucv049,281,2015,Does Your Company Have the Right Logo? How and Why Circular- and Angular-Logo Shapes Influence Brand Attribute Judgments,1,TRUE
10.1177/0956797610384746,281,2010,Facing Freeze,0,FALSE
10.1007/s11121-007-0080-7,280,2008,Prevention of Behavior Problems for Children in Foster Care: Outcomes and Mediation Effects,0,FALSE
10.1177/016502547800100203,280,1978,An Experimental Evaluation of Four Face-to-Face Teaching Strategies,0,FALSE
10.1006/jesp.2001.1488,280,2002,The Influence of Approach and Avoidance Motor Actions on Creative Cognition,0,FALSE
10.1162/rest_a_00258,279,2012,Knowledge Transfers from Multinational to Domestic Firms: Evidence from Worker Mobility,0,FALSE
10.1177/0146167205279905,278,2005,From Psychological Need Satisfaction to Intentional Behavior: Testing a Motivational Sequence in Two Behavioral Contexts,0,FALSE
10.1016/0148-2963(95)00125-5,278,1996,Good and bad shopping vibes: Spending and patronage satisfaction,0,FALSE
10.1007/s11251-009-9093-x,276,2009,Productive failure in mathematical problem solving,1,TRUE
10.3109/13561820.2014.917407,275,2014,Validation of the interprofessional collaborative competency attainment survey (ICCAS),0,FALSE
10.1073/pnas.1520027113,275,2016,Working memory is not fixed-capacity: More active storage capacity for real-world objects than for simple stimuli,0,FALSE
10.1177/0146167213508791,273,2013,Value Judgments and the True Self,0,FALSE
10.1017/s0022381608080638,272,2008,Two Genes Predict Voter Turnout,0,FALSE
10.1111/j.0956-7976.2005.01556.x,271,2005,Linguistic Constraints on Statistical Computations,0,FALSE
10.1016/j.econedurev.2005.05.008,270,2006,"Teacher qualifications and early learning: Effects of certification, degree, and experience on first-grade student achievement",0,FALSE
10.1037/a0025883,270,2011,More than a body: Mind perception and the nature of objectification.,0,FALSE
10.1038/ng.974,270,2011,A genome-wide association study identifies common variants near LBX1 associated with adolescent idiopathic scoliosis,2,TRUE
10.1037/a0021282,269,2010,Development of the Counseling Center Assessment of Psychological Symptoms-62 (CCAPS-62).,0,FALSE
10.1037/a0034755,269,2013,Emotional intelligence is a second-stratum factor of intelligence: Evidence from hierarchical and bifactor models.,2,TRUE
10.1163/15685370260441008,269,2002,Intuitive Conceptions of Dead Agents' Minds: The Natural Foundations of Afterlife Beliefs as Phenomenological Boundary,0,FALSE
10.1371/journal.pone.0181640,269,2017,Misinformation lingers in memory: Failure of three pro-vaccination strategies,2,TRUE
10.1037/0022-3514.90.4.543,268,2006,What do i think you're doing? Action identification and mind attribution.,0,FALSE
10.1257/aer.102.2.865,268,2012,Thar She Bursts: Reducing Confusion Reduces Bubbles,0,FALSE
10.1093/brain/awq154,268,2010,Measuring cognitive reserve based on the decomposition of episodic memory variance,0,FALSE
10.1086/661890,267,2011,Retracted: Super Size Me: Product Size as a Signal of Status,0,FALSE
10.1177/0003122410378232,266,2010,Stratification by Skin Color in Contemporary Mexico,4,TRUE
10.1016/j.neulet.2009.06.030,266,2009,Testing assumptions of statistical learning: Is it long-term and implicit?,0,FALSE
10.1016/j.cognition.2007.09.006,265,2007,Altered vision near the hands,0,FALSE
10.1111/j.1467-9280.2008.02187.x,265,2008,Adaptive Responses to Social Exclusion,1,TRUE
10.1001/jamapsychiatry.2015.1977,264,2015,Inflammation and Specific Symptoms of Depression,0,FALSE
10.1037/pst0000015,264,2015,The role of deliberate practice in the development of highly effective psychotherapists.,0,FALSE
10.1111/j.1551-6709.2010.01164.x,263,2011,The Cognitive Dynamics of Negated Sentence Verification,0,FALSE
10.1016/j.cognition.2013.02.008,262,2013,Lay denial of knowledge for justified true beliefs,0,FALSE
10.1037/0278-7393.34.2.369,262,2008,Orienting attention in visual working memory reduces interference from memory probes.,0,FALSE
10.1037/cou0000131,261,2016,Do psychotherapists improve with time and experience? A longitudinal analysis of outcomes in a clinical setting.,3,TRUE
10.1080/10584609.1994.9963030,260,1994,Agenda setting and political advertising: Origins of the news agenda,0,FALSE
10.1145/1449715.1449724,260,2008,OctoPocus,0,FALSE
10.1080/03634529909379152,260,1999,The relationship between student perceptions of instructor humor and students’ reports of learning,0,FALSE
10.1111/j.1467-9280.2008.02061.x,259,2008,Affective Flexibility,0,FALSE
10.1001/archgenpsychiatry.2009.153,259,2009,Interactive Effect of Stressful Life Events and the Serotonin Transporter 5-HTTLPR Genotype on Posttraumatic Stress Disorder Diagnosis in 2 Independent Populations,0,FALSE
10.2307/976307,258,1986,Contracting out: For What? With Whom?,0,FALSE
10.1016/j.cortex.2007.08.010,258,2007,Horizontal spatial representations of time: Evidence for the STEARC effect,0,FALSE
10.2753/mis0742-1222240209,256,2007,The Role of Information Systems Resources in ERP Capability Building and Business Process Outcomes,0,FALSE
10.1111/j.1467-9280.2008.02082.x,256,2008,Emotional Valence and Arousal Interact in Attentional Control,0,FALSE
10.1037/0022-3514.94.3.429,255,2008,Balancing connectedness and self-protection goals in close relationships: A levels-of-processing perspective on risk regulation.,0,FALSE
10.1111/j.1467-9922.2007.00400.x,255,2007,Effects of Textual Enhancement and Topic Familiarity on Korean EFL Students' Reading Comprehension and Learning of Passive Form,0,FALSE
10.1177/0956797610362675,255,2010,Eavesdropping on Happiness,0,FALSE
10.1111/j.1475-4975.2007.00158.x,254,2007,"Free Will, Moral Responsibility, and Mechanism: Experiments on Folk Intuitions",1,TRUE
10.1177/0956797614545886,253,2014,Pain as Social Glue: Shared Pain Increases Cooperation,0,FALSE
10.1177/0956797616669086,253,2016,The Wisdom to Know the Difference,0,FALSE
10.1037/edu0000193,251,2017,"Examining the relations between executive function, math, and literacy during the transition to kindergarten: A multi-analytic approach.",0,FALSE
10.1093/jopart/muu053,250,2015,Unconscious Bias in Citizens’ Evaluations of Public Sector Performance,1,TRUE
10.1037/a0023527,247,2011,The substitutability of physical and social warmth in daily life.,1,TRUE
10.1177/0146167207309195,247,2007,When Being a Model Minority Is Good . . . and Bad: Realistic Threat Explains Negativity Toward Asian Americans,1,TRUE
10.1176/appi.ajp.160.11.1965,246,2003,The Serotonin System and Spiritual Experiences,4,TRUE
10.1037/0278-7393.21.4.1008,246,1995,Functional equivalence of verbal and spatial information in serial short-term memory.,1,TRUE
10.1177/0956797611429579,245,2012,Cuing Consumerism,1,TRUE
10.1016/j.jesp.2009.03.013,245,2009,When misconduct goes unnoticed: The acceptability of gradual erosion in others’ unethical behavior,1,TRUE
10.1073/pnas.1103343108,244,2011,Motivating voter turnout by invoking the self,0,FALSE
10.1509/jppm.29.2.265,244,2010,Understanding how Graphic Pictorial Warnings Work on Cigarette Packaging,0,FALSE
10.1377/hlthaff.2012.0393,243,2012,Six Features Of Medicare Coordinated Care Demonstration Programs That Cut Hospital Admissions Of High-Risk Patients,0,FALSE
10.1016/j.cognition.2011.04.005,242,2011,When ignorance is no excuse: Different roles for intent across moral domains,0,FALSE
10.5840/jphil20111081238,242,2011,"Causation, Norm Violation, and Culpable Control",0,FALSE
10.1016/j.jfineco.2018.01.009,242,2018,Busy directors and firm performance: Evidence from mergers,0,FALSE
10.1177/0956797610372631,241,2010,Keep Your Fingers Crossed!,1,TRUE
10.3389/fpsyg.2014.00444,240,2014,Effortless inhibition: habit mediates the relation between self-control and unhealthy snack consumption,1,TRUE
10.1080/07421656.2005.10129441,239,2005,Can Coloring Mandalas Reduce Anxiety?,1,TRUE
10.1521/pedi.2010.24.4.516,239,2010,Toward a More Psychometrically Sound Brief Measure of Schizotypal Traits: Introducing the SPQ-Brief Revised,0,FALSE
10.1111/puar.12401,239,2015,Representative Bureaucracy and the Willingness to Coproduce: An Experimental Study,1,TRUE
10.1016/j.brainres.2005.11.046,239,2006,Identification of first candidate genes for creativity: A pilot study,1,TRUE
10.1016/j.cub.2011.09.049,238,2011,Working memory without consciousness,0,FALSE
10.1016/j.appet.2016.07.009,237,2016,"Meat eaters by dissociation: How we present, prepare and talk about meat increases willingness to eat meat by reducing empathy and disgust",1,TRUE
10.1111/j.1467-9280.2008.02062.x,237,2008,"Effects of Fluency on Psychological Distance and Mental Construal (or Why New York Is a Large City, but <i>New York</i> Is a Civilized Jungle)",1,TRUE
10.1111/j.1467-9280.2007.01961.x,236,2007,Moral Hypocrisy,1,TRUE
10.1371/journal.pgen.1000378,236,2009,Identification of a Shared Genetic Susceptibility Locus for Coronary Heart Disease and Periodontitis,1,TRUE
10.1038/ng.2390,236,2012,Genome-wide association analyses identify three new susceptibility loci for primary angle closure glaucoma,1,TRUE
10.1111/j.1467-9922.2006.00374.x,235,2006,Effects of Stimulus Characteristics and Background Music on Foreign Language Vocabulary Learning and Forgetting,1,TRUE
10.1111/1468-0297.00407,234,1999,The Editors and Authors of Economics Journals: a Case of Institutional Oligopoly?,0,FALSE
10.1007/bf00299299,233,1982,Mechanisms of avian egg recognition: Which egg parameters elicit responses by rejecter species?,0,FALSE
10.1111/j.1467-9922.2012.00730.x,232,2012,Explicit and Implicit Lexical Knowledge: Acquisition of Collocations Under Different Input Conditions,0,FALSE
10.1037/a0038647,231,2015,Personality change following unemployment.,0,FALSE
10.1080/02701367.2005.10599260,231,2005,Self-Controlled Feedback Is Effective if It Is Based on the Learner's Performance,0,FALSE
10.1145/985692.985709,231,2004,Deception and design,0,FALSE
10.1093/scan/nsn046,229,2009,Emergence of enhanced attention to fearful faces between 5 and 7 months of age,1,TRUE
10.1080/02699930802652388,229,2009,Biased attention and dysphoria: Manipulating selective attention reduces subsequent depressive symptoms,0,FALSE
10.1002/ajmg.b.31028,228,2009,Methylation at <i>SLC6A4</i> is linked to family history of child abuse: An examination of the Iowa Adoptee sample,0,FALSE
10.1111/j.1467-9280.2008.02159.x,228,2008,A Wrinkle in Time,0,FALSE
10.1037/0022-3514.92.1.97,228,2007,"Less is more: The lure of ambiguity, or why familiarity breeds contempt.",1,TRUE
10.1177/0956797615598739,225,2015,A Gender Bias in the Attribution of Creativity,0,FALSE
10.1177/0956797618780643,225,2018,Implicit Theories of Interest: Finding Your Passion or Developing It?,0,FALSE
10.1192/bjp.142.2.139,225,1983,Binge-eating and Self-induced Vomiting in the Community,0,FALSE
10.1016/j.jfbs.2016.08.001,225,2016,Measuring socioemotional wealth in family-owned and -managed firms: A validation and short form of the FIBER Scale,0,FALSE
10.1006/cogp.1998.0690,224,1998,Object Individuation in Infancy: The Use of Featural Information in Reasoning about Occlusion Events,0,FALSE
10.1901/jaba.1976.9-179,224,1976,THE EFFECTS OF A SELF‐INSTRUCTIONAL PACKAGE ON OVERACTIVE PRESCHOOL BOYS,0,FALSE
10.3233/jad-2009-1163,223,2009,Impact of APOE on the Healthy Aging Brain: A Voxel-Based MRI and DTI Study,0,FALSE
10.1016/j.cognition.2010.12.009,222,2011,Plasticity of human spatial cognition: Spatial language and cognition covary across cultures,0,FALSE
10.1111/j.1467-8624.2009.01312.x,222,2009,Social Perception in Infancy: A Near Infrared Spectroscopy Study,0,FALSE
10.1037/0022-3514.46.4.778,222,1984,The evening news and presidential evaluations.,0,FALSE
10.1006/jmla.2000.2737,222,2001,Cross-Language Priming Asymmetries in Lexical Decision and Episodic Recognition,0,FALSE
10.1073/pnas.1706253114,220,2017,Exposure to rising inequality shapes Americans’ opportunity beliefs and policy support,0,FALSE
10.1002/ana.22403,220,2011,Genome‐wide association studies of cerebral white matter lesion burden,0,FALSE
10.1073/pnas.1707719114,219,2017,Americans misperceive racial economic equality,1,TRUE
10.1177/0956797614561266,219,2015,How Will I Be Remembered? Conserving the Environment for the Sake of One’s Legacy,0,FALSE
10.1177/0956797611431465,219,2012,The Persistence of Thought,1,TRUE
10.1038/ng.2007.47,219,2007,Polymorphism at the TNF superfamily gene TNFSF4 confers susceptibility to systemic lupus erythematosus,0,FALSE
10.1016/j.jesp.2010.05.014,218,2010,Elaboration enhances the imagined contact effect,1,TRUE
10.1037/0022-3514.94.4.600,218,2008,A social functional approach to emotions in bargaining: When communicating anger pays and when it backfires.,1,TRUE
10.1257/aer.20130683,218,2015,"Thar SHE Blows? Gender, Competition, and Bubbles in Experimental Asset Markets",0,FALSE
10.1177/215416470604100404,218,2006,Comparing Video Prompting to Video Modeling for Teaching Daily Living Skills to Six Adults with Developmental Disabilities,0,FALSE
10.1037/0022-3514.94.1.158,217,2008,Poignancy: Mixed emotional experience in the face of meaningful endings.,0,FALSE
10.3758/bf03194043,217,2007,Visual working memory as the substrate for mental rotation,2,TRUE
10.1080/14719037.2013.822532,217,2013,Did New Public Management Matter? An empirical analysis of the outsourcing and decentralization effects on public sector size,0,FALSE
10.1073/pnas.1601280113,216,2016,Uncalculating cooperation is used to signal trustworthiness,0,FALSE
10.1038/mp.2015.109,216,2015,Brain connectomics predict response to treatment in social anxiety disorder,3,TRUE
10.3389/fnhum.2013.00014,216,2013,Error awareness and the insula: links to neurological and psychiatric diseases,0,FALSE
10.1002/pam.21702,215,2013,An Experimental Test of the Expectancy-Disconfirmation Theory of Citizen Satisfaction,0,FALSE
10.1007/s10071-012-0510-1,215,2012,Empathic-like responding by domestic dogs (Canis familiaris) to distress in humans: an exploratory study,2,TRUE
10.3102/0002831210362589,215,2010,"Different Tests, Different Answers",0,FALSE
