doi,cited_by_count,publication_year,title,n_pages,found_on_wiki
10.1177/0956797614558718,55,2014,Anchors Weigh More Than Power,0,FALSE
10.3758/s13414-019-01723-6,55,2019,Standing enhances cognitive control and alters visual search,0,FALSE
10.1037/a0031337,55,2013,The negative testing effect and multifactor account.,0,FALSE
10.1901/jaba.1982.15-533,55,1982,PROCEDURAL VARIATIONS IN GROUP CONTINGENCIES: EFFECTS ON CHILDREN'S ACADEMIC AND SOCIAL BEHAVIORS,0,FALSE
10.1348/014466609x473956,55,2009,The positive feedback bias as a response to self‐image threat,0,FALSE
10.1198/073500102317352029,55,2002,Estimating Lorenz Curves Using a Dirichlet Distribution,0,FALSE
10.1016/j.heares.2013.12.003,55,2013,Top–down restoration of speech in cochlear-implant users,2,TRUE
10.1016/j.joca.2011.10.004,55,2011,Association of a single nucleotide polymorphism in pregnancy-associated plasma protein-A2 with developmental dysplasia of the hip: a case–control study,0,FALSE
10.1007/s11858-016-0819-3,55,2016,Does students’ interest in a mathematical problem depend on the problem’s connection to reality? An analysis of students’ interest and pre-service teachers’ judgments of students’ interest in problems with and without a connection to reality,0,FALSE
10.1002/jcpy.1028,54,2018,Did They Earn It? Observing Unearned Luxury Consumption Decreases Brand Attitude When Observers Value Fairness,0,FALSE
10.1128/jvi.79.15.9746-9755.2005,54,2005,Persistence of Bovine Viral Diarrhea Virus Is Determined by a Cellular Cofactor of a Viral Autoprotease,0,FALSE
10.1038/sj.mp.4001753,54,2005,Quantitative trait locus analysis of nonverbal communication in autism spectrum disorder,0,FALSE
10.1016/j.actpsy.2018.04.007,54,2018,The universal and automatic association between brightness and positivity,0,FALSE
10.1016/j.jpsychires.2015.12.001,54,2015,CNS- and ANS-arousal predict response to antidepressant medication: Findings from the randomized iSPOT-D study,0,FALSE
10.1080/10447318.2011.595621,54,2011,Skill Progression Demonstrated by Users in the Scratch Animation Environment,0,FALSE
10.1111/j.1467-9280.2008.02049.x,53,2008,Extremal Edge,0,FALSE
10.1111/j.1467-9280.2008.02093.x,53,2008,Personality Dominance and Preferential Use of the Vertical Dimension of Space,0,FALSE
10.1371/journal.pone.0226284,53,2019,Attentional capture by Pavlovian reward-signalling distractors in visual search persists when rewards are removed,0,FALSE
10.1002/jcop.21511,53,2012,A RANDOMIZED TRIAL OF MOTIVATIONAL INTERVIEWING TO IMPROVE MIDDLE SCHOOL STUDENTS’ ACADEMIC PERFORMANCE,0,FALSE
10.1080/09084282.2010.523365,53,2011,Comparison Between the Test of Memory Malingering (TOMM) and the Nonverbal Medical Symptom Validity Test (NV-MSVT) in Adults With Disability Claims,0,FALSE
10.1901/jaba.2006.46-05,53,2006,ASSESSMENT OF DEVIANT AROUSAL IN ADULT MALE SEX OFFENDERS WITH DEVELOPMENTAL DISABILITIES,0,FALSE
10.1901/jaba.2004.37-11,53,2004,A RAPID ASSESSMENT OF SKILLS IN YOUNG CHILDREN WITH AUTISM,0,FALSE
10.1177/2167702612472487,53,2013,Mild Uncertainty Promotes Checking Behavior in Subclinical Obsessive-Compulsive Disorder,0,FALSE
10.1016/j.paid.2012.04.036,52,2012,Identifying the cognitive basis of mental toughness: Evidence from the directed forgetting paradigm,0,FALSE
10.1109/tse.2016.2527791,52,2016,The Role of Method Chains and Comments in Software Readability and Comprehension—An Experiment,0,FALSE
10.1177/0956797620927967,52,2020,Affective Arousal Links Sound to Meaning,0,FALSE
10.1515/ling.2011.016,52,2011,Once again on norms and comparison classes,0,FALSE
10.1145/2380718.2380739,52,2012,Crowd IQ,0,FALSE
10.1016/j.nicl.2018.02.020,52,2018,Hemispheric brain asymmetry differences in youths with attention-deficit/hyperactivity disorder,2,TRUE
10.1016/j.paid.2009.11.029,52,2009,"Paranormal experiences, mental health and mental boundaries, and psi",0,FALSE
10.1038/srep30423,52,2016,Skilled musicians are not subject to the McGurk effect,0,FALSE
10.1111/jcom.12135,51,2014,Police Detection of Deception: Beliefs About Behavioral Cues to Deception Are Strong Even Though Contextual Evidence Is More Useful,0,FALSE
10.1126/science.1091721,51,2003,Do Defaults Save Lives?,4,TRUE
10.1177/0956797615617779,51,2015,Beyond Faces and Expertise,0,FALSE
10.1177/0956797616630964,51,2016,Attention Alters Perceived Attractiveness,0,FALSE
10.1257/aer.101.2.819,51,2011,Deferred Compensation in Multiperiod Labor Contracts: An Experimental Test of Lazear's Model,1,TRUE
10.1016/j.jecp.2016.11.008,51,2016,Competing features influence children’s attention to number,0,FALSE
10.1097/fpc.0b013e32800ffbb4,51,2007,Association of the RGS2 gene with extrapyramidal symptoms induced by treatment with antipsychotic medication,0,FALSE
10.1086/691684,51,2017,Multisyllabic Word-Reading Instruction With and Without Motivational Beliefs Training for Struggling Readers in the Upper Elementary Grades: A Pilot Investigation,0,FALSE
10.1123/ijspp.2019-0098,51,2019,"Acute Enhancement of Jump Performance, Muscle Strength, and Power in Resistance-Trained Men After Consumption of Caffeinated Chewing Gum",0,FALSE
10.3109/13816810.2015.1005317,51,2015,Evaluating the Association between Keratoconus and Reported Genetic Loci in a Han Chinese Population,0,FALSE
10.1002/art.38110,51,2013,"A Genome‐Wide Association Study Reveals <i>ARL15</i>, a Novel Non‐HLA Susceptibility Gene for Rheumatoid Arthritis in North Indians",0,FALSE
10.1016/j.neulet.2004.10.018,51,2004,Modulation of age at onset of Huntington disease patients by variations in TP53 and human caspase activated DNase (hCAD) genes,0,FALSE
10.1002/ajhb.20823,51,2008,"Cultural consonance, a 5HT2A receptor polymorphism, and depressive symptoms: A longitudinal study of gene × culture interaction in urban Brazil",0,FALSE
10.1007/s11098-010-9651-8,50,2010,What in the world is weakness of will?,0,FALSE
10.1016/s0749-5978(02)00013-4,50,2002,Beyond mere ownership: transaction demand as a moderator of the endowment effect,0,FALSE
10.1111/j.1467-9280.2008.02050.x,50,2008,Auditory Change Detection: Simple Sounds Are Not Memorized Better Than Complex Sounds,0,FALSE
10.1111/j.1532-5415.2008.01710.x,50,2008,Chief Resident Immersion Training in the Care of Older Adults: An Innovative Interspecialty Education and Leadership Intervention,0,FALSE
10.1002/jip.55,50,2007,From marine ecology to crime analysis: Improving the detection of serial sexual offences using a taxonomic similarity measure,0,FALSE
10.1901/jaba.2011.44-121,50,2011,EFFECTS OF PEDESTRIAN PROMPTS ON MOTORIST YIELDING AT CROSSWALKS,0,FALSE
10.1037/0278-7393.28.1.233,50,2002,The activation of word class information during speech production.,0,FALSE
10.1037/1931-3896.2.1.8,50,2008,How shape constancy relates to drawing accuracy.,1,TRUE
10.1177/0956797615572231,49,2015,"When Does the Future Begin? Time Metrics Matter, Connecting Present and Future Selves",0,FALSE
10.1145/3180155.3180192,49,2018,When testing meets code review,0,FALSE
10.1073/pnas.2120668119,49,2022,Relational diversity in social portfolios predicts well-being,0,FALSE
10.1177/0020872818804298,49,2018,Resilience as a moderator of stress and burnout: A study of women social workers in India,0,FALSE
10.1086/678193,49,2014,The Offer Framing Effect: Choosing Single versus Bundled Offerings Affects Variety Seeking,0,FALSE
10.1037/a0024608,49,2011,Unconscious addition: When we unconsciously initiate and follow arithmetic rules.,0,FALSE
10.1037/xge0000738,48,2020,"Victims, perpetrators, or both? The vicious cycle of disrespect and cynical beliefs about human nature.",0,FALSE
10.1073/pnas.1805327115,48,2018,People use less information than they think to make up their minds,0,FALSE
10.1111/j.1551-6709.2010.01161.x,48,2011,Seeking Confirmation Is Rational for Deterministic Hypotheses,0,FALSE
10.1177/0956797618788882,48,2018,Inferring Whether Officials Are Corruptible From Looking at Their Faces,0,FALSE
10.1177/0956797619879441,48,2019,Development of Holistic Episodic Recollection,0,FALSE
10.1007/s10803-008-0608-0,48,2008,Brief Report: Eye-Movement Patterns During an Embedded Figures Test in Children with ASD,0,FALSE
10.1093/scan/nsu108,48,2014,The association between the 5-HTTLPR and neural correlates of fear conditioning and connectivity,0,FALSE
10.1080/17461391.2017.1308560,48,2017,Side‐to‐side differences in lower extremity biomechanics during multi‐directional jump landing in volleyball athletes,0,FALSE
10.1016/j.jocrd.2014.08.002,48,2014,Concentrated ERP delivered in a group setting: An effectiveness study,0,FALSE
10.1038/sj.mp.4000515,48,1999,Polymorphisms of the human homologue of the Drosophila white gene are associated with mood and panic disorders,0,FALSE
10.1177/2167702618757658,48,2018,Lateral Eye Movements Increase False Memory Rates,0,FALSE
10.1257/aer.101.7.3109,47,2011,Happiness and Time Preference: The Effect of Positive Affect in a Random-Assignment Experiment,0,FALSE
10.2196/26134,47,2021,"Social Media Use, Physical Activity, and Internalizing Symptoms in Adolescence: Cross-sectional Analysis",0,FALSE
10.3998/mpub.9946611,47,2018,Drones and Support for the Use of Force,0,FALSE
10.1017/thg.2015.66,47,2015,The Colorado Longitudinal Twin Study of Reading Difficulties and ADHD: Etiologies of Comorbidity and Stability,0,FALSE
10.1097/01.naq.0000305943.46440.77,47,2008,Creating a Profile of a Nurse Effective in Caring,0,FALSE
10.1177/0956797617705399,46,2017,Black and White Lies: Race-Based Biases in Deception Judgments,0,FALSE
10.1111/j.1467-8624.2012.01748.x,46,2012,Preschoolers Acquire General Knowledge by Sharing in Pretense,0,FALSE
10.1037/a0032028,46,2013,Updating of episodic memories depends on the strength of new learning after memory reactivation.,1,TRUE
10.1038/tp.2017.146,46,2017,The steroid metabolome in women with premenstrual dysphoric disorder during GnRH agonist-induced ovarian suppression: effects of estradiol and progesterone addback,1,TRUE
10.1136/jmedgenet-2013-101705,46,2013,"Genome-wide association study of sex hormones, gonadotropins and sex hormone–binding protein in Chinese men",0,FALSE
10.1016/j.neulet.2011.02.024,46,2011,Genetic variation in FOXP2 alters grey matter concentrations in schizophrenia patients,0,FALSE
10.1016/j.brs.2021.02.002,46,2021,Asymmetric transcallosal conduction delay leads to finer bimanual coordination,0,FALSE
10.1037/e519682015-069,46,2012,Political Extremism is Supported by an Illusion of Understanding,0,FALSE
10.1002/soej.12223,45,2017,Gender Differences in the Giving and Taking Variants of the Dictator Game,1,TRUE
10.1016/j.learninstruc.2018.05.004,45,2018,Effectiveness of an early reading intervention in a semi-transparent orthography: A group randomised controlled trial,0,FALSE
10.1017/epi.2013.23,45,2013,GETTIERIZED KNOBE EFFECTS,0,FALSE
10.1027/1864-9335/a000147,45,2013,"Warmer Hearts, Warmer Rooms",0,FALSE
10.1073/pnas.2218961120,45,2023,Thinking about God increases acceptance of artificial intelligence in decision-making,0,FALSE
10.1177/0956797615585002,45,2015,Capacity for Visual Features in Mental Rotation,0,FALSE
10.1249/mss.0000000000000818,45,2015,Maximizing Performance,0,FALSE
10.3758/app.71.1.9,45,2009,Symmetrical interaction of sex and expression in face classification tasks,0,FALSE
10.3389/fpsyg.2014.01518,45,2015,Combat high or traumatic stress: violent offending is associated with appetitive aggression but not with symptoms of traumatic stress,0,FALSE
10.1002/jaba.385,45,2017,Improving the interview skills of college students using behavioral skills training,0,FALSE
10.1177/1948550612447114,45,2012,Wholesome Foods and Wholesome Morals?,0,FALSE
10.1038/ncomms1262,45,2011,Representational format determines numerical competence in monkeys,0,FALSE
10.1017/cbo9780511667268.005,45,2007,"Lexical profiles, learning styles and the construct validity of lexical size tests",0,FALSE
10.1037/0278-7393.34.1.128,44,2008,Multiple roles for time in short-term memory: Evidence from serial recall of order and timing.,0,FALSE
10.1002/imhj.21653,44,2017,ASSESSING ANGELS IN THE NURSERY: A PILOT STUDY OF CHILDHOOD MEMORIES OF BENEVOLENT CAREGIVING AS PROTECTIVE INFLUENCES,0,FALSE
10.1016/j.adolescence.2017.01.006,44,2017,Current and recalled childhood gender identity in community youth in comparison to referred adolescents seeking sex reassignment,0,FALSE
10.1186/s13229-020-00389-4,44,2020,Gray matter covariations and core symptoms of autism: the EU-AIMS Longitudinal European Autism Project,0,FALSE
10.1249/mss.0000000000002323,44,2020,Does Mental Fatigue Negatively Affect Outcomes of Functional Performance Tests?,0,FALSE
10.1038/oby.2005.12,43,2005,Bottomless bowls: why visual cues of portion size may influence intake.,1,TRUE
10.1073/pnas.1505067112,43,2015,Selfish third parties act as peacemakers by transforming conflicts and promoting cooperation,0,FALSE
10.1089/cyber.2015.0311,43,2015,Behavioral Bias for Food Reflected in Hand Movements: A Preliminary Study with Healthy Subjects,0,FALSE
10.1093/carcin/bgr100,43,2011,Common genetic variants related to genomic integrity and risk of papillary thyroid cancer,0,FALSE
10.1097/j.pain.0000000000001232,43,2018,Altered prefrontal correlates of monetary anticipation and outcome in chronic pain,0,FALSE
10.1017/s0272263118000244,43,2018,SOCIAL ATTITUDES AND SPEECH RATINGS,0,FALSE
10.1016/j.dcn.2015.09.007,43,2015,Toddlers’ dysregulated fear predicts delta–beta coupling during preschool,0,FALSE
10.1037/tra0000276,43,2017,"Military sexual trauma is associated with eating disorders, while combat exposure is not.",1,TRUE
10.1207/s15328023top2704_02,43,2000,Statistical Training in Psychology: A National Survey and Commentary on Undergraduate Programs,0,FALSE
10.1037/0096-1523.25.4.1005,43,1999,Change of intensity fails to produce an irrelevant sound effect: Implications for the representation of unattended sound.,0,FALSE
10.1162/qjec.121.1.73,43,1985,The Stigmatized Woman: The Professional Woman in a Male Sex-Typed Career.,10,TRUE
10.1111/j.1467-9280.2008.02060.x,42,2008,The Best Men Are (Not Always) Already Taken,0,FALSE
10.1509/jppm.16.157,42,2017,Effects of Perceived Scarcity on Financial Decision Making,0,FALSE
10.3109/10253890.2015.1040987,42,2015,A streamlined approach for assessing the Allostatic Load Index in industrial employees,0,FALSE
10.1016/j.learninstruc.2015.12.002,42,2015,Improving problem solving with subgoal labels in expository text and worked examples,0,FALSE
10.1037/xge0000232,42,2016,Competing while cooperating with the same others: The consequences of conflicting demands in co-opetition.,0,FALSE
10.7554/elife.10012,42,2016,Registered report: Fusobacterium nucleatum infection is prevalent in human colorectal carcinoma,0,FALSE
10.1080/09515080902802769,41,2009,Folk psychological concepts: Causation1,0,FALSE
10.3886/icpsr01218.v1,41,2000,Improving Quantitative Studies of International Conflict: A Conjecture,0,FALSE
10.1177/0731948712438556,41,2012,"A Reading Motivation Intervention With Differential Outcomes for Students At Risk for Reading Disabilities, ADHD, and Typical Comparisons",0,FALSE
10.1080/15622975.2016.1190033,41,2016,High-throughput DNA methylation analysis in anorexia nervosa confirms <i>TNXB</i> hypermethylation,0,FALSE
10.1007/s11002-005-0457-y,40,2004,"Variety-Seeking and Time of Day: Why Leader Brands Hope Young Adults Shop in the Afternoon, but Follower Brands Hope for Morning",0,FALSE
10.1093/ije/dyt028,40,2013,ALPK1 genetic regulation and risk in relation to gout,0,FALSE
10.1177/0267658311432200,40,2012,<i>That</i> ’s not so different from <i>the</i> : Definite and demonstrative descriptions in second language acquisition,0,FALSE
10.1016/j.paid.2008.08.019,40,2008,Handedness and behavioural inhibition: Left-handed females show most inhibition as measured by BIS/BAS self-report,0,FALSE
10.1002/jaba.453,40,2018,An evaluation of the agreement between the conservative dual‐criterion method and expert visual analysis,0,FALSE
10.1016/j.aos.2016.02.003,40,2016,Why controllers compromise on their fiduciary duties: EEG evidence on the role of the human mirror neuron system,0,FALSE
10.1017/psrm.2022.12,40,2022,Violent political rhetoric on Twitter,0,FALSE
10.1037/h0032236,40,1972,Developmental course of responsiveness to social reinforcement in normal children and institutionalized retarded children.,0,FALSE
10.1287/orsc.2021.1456,39,2021,"A Founding Penalty: Evidence from an Audit Study on Gender, Entrepreneurship, and Future Employment",0,FALSE
10.1177/0017896915610144,39,2015,Mental health literacy in post-secondary students,0,FALSE
10.1111/sms.13776,39,2020,Caffeine increases strength and power performance in resistance‐trained females during early follicular phase,0,FALSE
10.1111/j.1559-1816.2003.tb02783.x,39,2003,"Race and Cognitive‐Ability Test Performance: The Mediating Effects of Test Preparation, Test‐Taking Strategy Use and Self‐Eff icacy",0,FALSE
10.1002/jaba.394,39,2017,Using the dual-criteria methods to supplement visual inspection: An analysis of nonsimulated data,0,FALSE
10.1177/0022487118761860,38,2018,An Empirical Study of the Dimensionality of the Mathematical Knowledge for Teaching Construct,0,FALSE
10.1016/j.jretconser.2011.06.012,38,2011,Determinants of restaurant's owners/managers selection of wines to be offered on the wine list,0,FALSE
10.1093/qje/qjac034,38,2022,Improving Workplace Climate in Large Corporations: A Clustered Randomized Intervention,0,FALSE
10.1097/00006842-200103000-00012,37,2001,Prepulses Reduce the Pain of Cutaneous Electrical Shocks,0,FALSE
10.1177/0956797612445318,37,2012,The Faintest Speck of Dirt,0,FALSE
10.1177/0956797616669947,37,2016,From Power to Inaction,0,FALSE
10.1007/s11109-016-9383-3,37,2017,Are Voters Mobilized by a ‘Friend-and-Neighbor’ on the Ballot? Evidence from a Field Experiment,0,FALSE
10.1136/ard.2008.093252,37,2008,The cyclic GMP-dependent protein kinase II gene associates with gout disease: identified by genome-wide analysis and case–control study,0,FALSE
10.1016/j.psychsport.2021.102099,36,2021,A psychological intervention reduces doping likelihood in British and Greek athletes: A cluster randomized controlled trial,0,FALSE
10.1037/0278-7393.34.2.408,36,2008,"Intentional forgetting is easier after two ""shots"" than one.",0,FALSE
10.1037/mot0000097,36,2018,Beyond motivated reasoning: Hostile reactions to critical comments from the outgroup.,0,FALSE
10.1093/jcr/ucx066,36,2017,Eliciting Time versus Money: Time Scarcity Underlies Asymmetric Wage Rates,0,FALSE
10.1177/0956797618818484,36,2018,The Zero-Sum Fallacy in Evidence Evaluation,1,TRUE
10.3389/fped.2019.00206,36,2019,"Genetic Predisposition for Immune System, Hormone, and Metabolic Dysfunction in Myalgic Encephalomyelitis/Chronic Fatigue Syndrome: A Pilot Study",0,FALSE
10.1177/0149206319833445,36,2019,Mind Your Language: The Effects of Linguistic Ostracism on Interpersonal Work Behaviors,0,FALSE
10.1177/0014402916658658,36,2016,Student and Teacher Outcomes of the Class-Wide Function-Related Intervention Team Efficacy Trial,0,FALSE
10.3389/fnhum.2017.00468,36,2017,Do Neuroscience Journals Accept Replications? A Survey of Literature,3,TRUE
10.1002/pits.22106,36,2018,Professional development to increase teacher behavior‐specific praise: A single‐case design replication,0,FALSE
10.1080/17461391.2017.1333159,36,2017,Carbohydrate mouth rinse improves morning high‐intensity exercise performance,0,FALSE
10.1038/s41598-017-05456-0,36,2017,Midnolin is a novel regulator of parkin expression and is associated with Parkinson’s Disease,0,FALSE
10.1177/0956797611406445,36,2011,Read-Out of Emotional Information From Iconic Memory,0,FALSE
10.1002/hipo.23099,36,2019,Evidence for age‐related deficits in object‐location binding during place recognition,0,FALSE
10.1371/journal.pone.0220282,36,2019,Thinking in action: Need for Cognition predicts Self-Control together with Action Orientation,0,FALSE
10.1037/amp0001079,36,2023,Does intergroup contact foster solidarity with the disadvantaged? A longitudinal analysis across 7 years.,0,FALSE
10.4054/demres.2019.40.2,36,2019,Weak support for a U-shaped pattern between societal gender equality and fertility when comparing societies across time,0,FALSE
10.1111/ejn.15049,36,2020,"The interplay between executive control, behavioural variability and mind wandering: Insights from a high‐definition transcranial direct‐current stimulation study",0,FALSE
10.1016/j.appet.2020.104808,35,2020,Patterns of negative emotional eating among Chinese young adults: A latent class analysis,0,FALSE
10.1016/j.paid.2014.11.040,35,2014,"Moral perfectionism and moral values, virtues, and judgments: A preliminary investigation",0,FALSE
10.1037/0278-7393.34.3.439,35,2008,How to say no: Single- and dual-process theories of short-term recognition tested on negative probes.,0,FALSE
10.1145/3517745.3561436,35,2022,A few shots traffic classification with mini-FlowPic augmentations,0,FALSE
10.1073/pnas.2209414120,35,2023,Social Frailty Index: Development and validation of an index of social attributes predictive of mortality in older adults,0,FALSE
10.1093/rfs/hhy109,35,2018,Unleashing Animal Spirits: Self-Control and Overpricing in Experimental Asset Markets,0,FALSE
10.1519/jsc.0000000000001503,35,2016,"Age-Related Differences in Maximal and Rapid Torque Characteristics of the Hip Extensors and Dynamic Postural Balance in Healthy, Young and Old Females",0,FALSE
10.2337/diabetes.53.9.2467,35,2004,Genetic Variation in <i>BEACON</i> Influences Quantitative Variation in Metabolic Syndrome–Related Phenotypes,0,FALSE
10.1037/pst0000133,34,2018,The effects of relationship and progress feedback in group psychotherapy using the Group Questionnaire and Outcome Questionnaire–45: A randomized clinical trial.,0,FALSE
10.1073/pnas.1517662112,34,2015,Conservatives negatively evaluate counterstereotypical people to maintain a sense of certainty,0,FALSE
10.1177/0146167215580776,34,2015,Using High-Level Construal and Perceptions of Changeability to Promote Self-Change Over Self-Protection Motives in Response to Negative Feedback,0,FALSE
10.1891/0886-6708.26.6.703,34,2011,The Gender Asymmetric Effect of Intimate Partner Violence on Relationship Satisfaction,0,FALSE
10.1177/1088357615618941,34,2015,Developing an Early Reading Intervention Aligned With the Down Syndrome Behavioral Phenotype,0,FALSE
10.5232/ricyde2010.01804,34,2010,Modelización y medida de la Calidad Percibida en centros deportivos: la escala QSport-10. (Modelling and Measuring Perceived Quality in Sports Centres: QSport-10 scale).,0,FALSE
10.2307/3586735,34,1987,Forming a Discipline: Applied Linguists' Literacy in Research Methodology and Statistics,0,FALSE
10.1162/jocn_a_00708,34,2014,Absolute Pitch: Evidence for Early Cognitive Facilitation during Passive Listening as Revealed by Reduced P3a Amplitudes,0,FALSE
10.1523/jneurosci.1959-18.2018,34,2018,Electrical Stimulation Over Human Posterior Parietal Cortex Selectively Enhances the Capacity of Visual Short-Term Memory,0,FALSE
10.1016/j.ijinfomgt.2018.03.001,33,2018,"Attitudinal, normative, and resource factors affecting psychologists’ intentions to adopt an open data badge: An empirical analysis",0,FALSE
10.1145/3328778.3366948,33,2020,Assessing Individual Contributions to Software Engineering Projects with Git Logs and User Stories,0,FALSE
10.1002/jaba.525,33,2018,Relative preferences for edible and leisure stimuli in children with autism,0,FALSE
10.1037/edu0000039,33,2015,Effects of a research-based intervention to improve seventh-grade students’ proportional problem solving: A cluster randomized trial.,0,FALSE
10.1521/ijgp.52.4.511.45520,33,2002,Interpersonal Predictors of Group Therapy Outcome for Complicated Grief,0,FALSE
10.1016/j.obhdp.2016.12.005,33,2017,Spillover bias in diversity judgment,0,FALSE
10.1111/ajps.12412,33,2018,Responsiveness without Representation: Evidence from Minimum Wage Laws in U.S. States,0,FALSE
10.1037/xhp0000463,33,2017,Adaptive face coding contributes to individual differences in facial expression recognition independently of affective factors.,0,FALSE
10.1007/s11145-010-9282-7,32,2010,Is preview benefit from word n + 2 a common effect in reading Chinese? Evidence from eye movements,0,FALSE
10.1037/0278-7393.34.3.460,32,2008,Stereotypes and retrieval-provoked illusory source recollections.,0,FALSE
10.1177/1948550611432938,32,2012,Testing the Death Thought Suppression and Rebound Hypothesis,1,TRUE
10.1002/ejsp.2219,32,2017,The moral contents of anti‐atheist prejudice (and why atheists should care about it),0,FALSE
10.1519/jsc.0000000000003009,32,2019,Effect of Attentional Focus Strategies on the Biomechanical Performance of the Drop Jump,0,FALSE
10.1016/j.jesp.2012.11.012,31,2012,“Black and White” thinking: Visual contrast polarizes moral judgment,0,FALSE
10.1177/0956797615608267,31,2015,Opportunity Cost Neglect Attenuates the Effect of Choices on Preferences,0,FALSE
10.1257/aer.101.2.927,31,2011,Coordination in the Presence of Asset Markets,0,FALSE
10.3389/fpsyg.2014.01276,31,2014,Does cleanliness influence moral judgments? Response effort moderates the effect of cleanliness priming on moral judgments,0,FALSE
10.1352/1934-9556-56.6.442,31,2018,Contextualizing Mathematics: Teaching Problem Solving to Secondary Students With Intellectual and Developmental Disabilities,0,FALSE
10.1007/s40732-014-0040-0,31,2014,Resurgence Under Delayed Reinforcement,0,FALSE
10.1111/j.1467-8624.1988.tb03262.x,31,1988,Maternal Sensitivity and Patterns of Infant-Mother Attachment,0,FALSE
10.3758/pp.70.3.477,31,2008,Kanizsa-type subjective contours do not guide attentional deployment in visual search but line termination contours do,0,FALSE
10.1002/jaba.863,31,2021,Machine learning to analyze single‐case graphs: A comparison to visual inspection,0,FALSE
10.1353/aad.0.0113,31,2009,Teaching Phonological Skills to a Deaf First Grader: A Promising Strategy,0,FALSE
