doi,cited_by_count,publication_year,title,n_pages,found_on_wiki
10.1037/0022-3514.94.4.696,134,2008,Terror management and adults' attachment to their parents: The safe haven remains.,0,FALSE
10.1080/09515080903532290,133,2010,"If you like it, does it matter if it's real?",1,TRUE
10.1080/01411926.2010.538468,133,2011,Influence of student learning experience on academic performance: The mediator and moderator effects of self‐regulation and motivation,0,FALSE
10.37016/mr-2020-47,133,2020,Breaking Harmony Square: A game that “inoculates” against political misinformation,0,FALSE
10.1002/ab.21544,133,2014,Face of a fighter: Bizygomatic width as a cue of formidability,0,FALSE
10.1016/s2215-0366(21)00241-8,132,2021,Antipsychotic use and risk of breast cancer in women with schizophrenia: a nationwide nested case-control study in Finland,0,FALSE
10.1086/679118,132,2014,Squeezed: Coping with Constraint through Efficiency and Prioritization,0,FALSE
10.48550/arxiv.2302.02083,132,2023,Evaluating Large Language Models in Theory of Mind Tasks,0,FALSE
10.1016/s0034-4257(03)00145-7,132,2003,Coupling spectral unmixing and trend analysis for monitoring of long-term vegetation dynamics in Mediterranean rangelands,0,FALSE
10.1177/0956797609359908,131,2010,What Counts as a Choice?,0,FALSE
10.1177/0956797611414726,131,2011,A Single Exposure to the American Flag Shifts Support Toward Republicanism up to 8 Months Later,0,FALSE
10.1371/journal.pone.0216241,131,2019,Mitigating gender bias in student evaluations of teaching,0,FALSE
10.1163/156853706776931385,130,2006,Folk Intuitions on Free Will,0,FALSE
10.1509/jmr.13.0451,130,2014,Scarcity Polarizes Preferences: The Impact on Choice among Multiple Items in a Product Class,0,FALSE
10.3102/0013189x13507104,130,2013,Outcome-Reporting Bias in Education Research,0,FALSE
10.1371/journal.pone.0004117,130,2009,The Sleeping Brain's Influence on Verbal Memory: Boosting Resistance to Interference,0,FALSE
10.1109/tvcg.2018.2832633,130,2018,Effects of AR Display Context Switching and Focal Distance Switching on Human Performance,0,FALSE
10.1016/j.neuroimage.2007.08.032,130,2007,The self in conflict: The role of executive processes during truthful and deceptive responses about attitudes,0,FALSE
10.1177/1948550611435136,129,2012,How Guilt and Pride Shape Subsequent Self-Control,0,FALSE
10.1037/0022-3514.94.2.94.2.231,128,2008,Selective exposure and information quantity: How different information quantities moderate decision makers' preference for consistent and inconsistent information.,0,FALSE
10.1521/pedi.17.2.152.23990,128,2003,Separate Personality Traits From States To Predict Depression,0,FALSE
10.1126/science.abb6591,128,2020,Behavioral nudges reduce failure to appear for court,2,TRUE
10.1186/s12913-017-2744-8,128,2017,Patient preferences for direct-to-consumer telemedicine services: a nationwide survey,0,FALSE
10.1257/aer.101.2.749,128,2011,The Bidder's Curse,1,TRUE
10.1177/0956797615625640,127,2016,Economic Insecurity Increases Physical Pain,1,TRUE
10.1111/j.1467-9280.2008.02066.x,126,2008,More Than Meets the Eye,1,TRUE
10.1097/00005053-198011000-00008,126,1980,The Nature of Verbal Impairment after Closed Head Injury,0,FALSE
10.1093/ageing/afx128,126,2017,Outcomes of Mobilisation of Vulnerable Elders in Ontario (MOVE ON): a multisite interrupted time series evaluation of an implementation intervention to increase patient mobilisation,0,FALSE
10.2307/329894,126,1992,The Effects of Language Anxiety on Students' Oral Test Performance and Attitudes,0,FALSE
10.1037//0022-0663.67.6.882,126,1975,Forward and backward digit span interaction with race and IQ: Predictions from Jensen's theory.,0,FALSE
10.1016/j.media.2013.06.003,126,2013,Automated drusen segmentation and quantification in SD-OCT images,0,FALSE
10.1037/a0020757,125,2010,When the future feels worse than the past: A temporal inconsistency in moral judgment.,0,FALSE
10.1177/0261927x01020004004,125,2001,Name Your Favorite Musician,0,FALSE
10.1177/0956797610363775,125,2010,Smile Intensity in Photographs Predicts Longevity,0,FALSE
10.1177/0956797611432497,125,2012,Is It Light or Dark? Recalling Moral Behavior Changes Perception of Brightness,0,FALSE
10.1007/bf03395755,125,2011,A Relational Frame Training Intervention to Raise Intelligence Quotients: A Pilot Study,0,FALSE
10.1037/0022-006x.62.3.636,125,1994,"The experience of ""forgetting"" childhood abuse: A national survey of psychologists.",0,FALSE
10.1111/j.1467-9280.2009.02339.x,125,2009,Compensatory Conscientiousness and Health in Older Couples,0,FALSE
10.1371/journal.pgen.1002656,125,2012,Runs of Homozygosity Implicate Autozygosity as a Schizophrenia Risk Factor,0,FALSE
10.1016/j.jml.2006.02.004,124,2006,"Roosters, robins, and alarm clocks: Aptness and conventionality in metaphor comprehension",0,FALSE
10.1093/sf/soy014,123,2018,"Working Hours and Carbon Dioxide Emissions in the United States, 2007–2013",0,FALSE
10.1521/jsyt.2012.31.2.21,123,2012,Making Positive Change: A Randomized Study Comparing Solution-Focused vs. Problem-Focused Coaching Questions,0,FALSE
10.1016/j.applanim.2006.03.017,123,2006,Measuring attention deficit and activity in dogs: A new application and validation of a human ADHD questionnaire,0,FALSE
10.1111/j.1540-627x.2012.00373.x,122,2012,Family Involvement in the Board of Directors: Effects on Sales Internationalization,0,FALSE
10.1037/0278-7393.34.1.167,121,2008,Decision making and learning while taking sequential risks.,0,FALSE
10.1177/0956797613497969,121,2013,Hierarchical Encoding Makes Individuals in a Group Seem More Attractive,2,TRUE
10.1017/s1366728914000273,120,2014,Flexibility in task switching by monolinguals and bilinguals,0,FALSE
10.1177/0956797615573516,120,2015,You Call It “Self-Exuberance”; I Call It “Bragging”,0,FALSE
10.1177/1948550617720269,120,2017,The Dark Side of a Smiley,0,FALSE
10.1037/ccp0000051,120,2015,Bounce back: Effectiveness of an elementary school-based intervention for multicultural children exposed to traumatic events.,0,FALSE
10.1016/j.pscychresns.2010.11.008,120,2011,Amygdala hyperreactivity in restrictive anorexia nervosa,0,FALSE
10.1023/b:rihe.0000027392.94172.d2,119,2004,A Review of Methodological Characteristics of Research Published in Key Journals in Higher Education: Implications for Graduate Research Training,0,FALSE
10.1016/j.tate.2015.08.004,119,2015,Exploring commitment and turnover intentions among teachers: What we can learn from Hong Kong teachers,0,FALSE
10.1080/08824096.2018.1525347,118,2018,Binge-Watching and Psychological Well-Being: Media Use Between Lack of Control and Perceived Autonomy,0,FALSE
10.1177/0956797617710785,118,2017,Mutualistic Coupling Between Vocabulary and Reasoning Supports Cognitive Development During Late Adolescence and Early Adulthood,0,FALSE
10.1017/s0272263110000264,118,2010,THE BOUNDS OF ADULT LANGUAGE ACQUISITION,0,FALSE
10.1097/00001888-200203000-00007,118,2002,The Hidden Curriculum in Multicultural Medical Education,1,TRUE
10.1177/0956797612452574,118,2013,Objects Don’t Object,0,FALSE
10.1037/0278-7393.34.1.249,117,2008,Semantic interference in a delayed naming task: Evidence for the response exclusion hypothesis.,0,FALSE
10.1177/1077559513483002,117,2013,Maltreatment Profiles Among Incarcerated Boys With Callous-Unemotional Traits,0,FALSE
10.1371/journal.pone.0154854,117,2016,Reasoning in Reference Games: Individual- vs. Population-Level Probabilistic Modeling,0,FALSE
10.1191/0969733002ne512oa,117,2002,Being a Good Nurse and Doing the Right Thing: a qualitative study,0,FALSE
10.1044/jslhr.4306.1440,117,2000,Treating Stuttering in Young Children,0,FALSE
10.1002/smj.2682,117,2017,Investor Reaction to Covert Corporate Political Activity,1,TRUE
10.1016/j.cortex.2014.02.013,116,2014,The neural signature of escalating frustration in humans,0,FALSE
10.1037/0278-7393.34.1.80,116,2008,An attention-based associative account of adjacent and nonadjacent dependency learning.,0,FALSE
10.1073/pnas.1610834113,116,2016,Past-focused environmental comparisons promote proenvironmental outcomes for conservatives,0,FALSE
10.1177/0963662514549688,116,2014,Blinded with science: Trivial graphs and formulas increase ad persuasiveness and belief in product efficacy,0,FALSE
10.1016/j.cognition.2013.09.001,116,2013,To adapt or not to adapt: The question of domain-general cognitive control,0,FALSE
10.1177/0956797615588195,115,2015,When Knowledge Knows No Bounds,0,FALSE
10.1257/aer.102.2.834,115,2012,"Screening, Competition, and Job Design: Economic Origins of Good Jobs",0,FALSE
10.1037/0278-7393.31.6.1267,115,2005,Understanding the Delayed-Keyword Effect on Metacomprehension Accuracy.,0,FALSE
10.1038/s41591-024-03283-1,115,2024,Data-driven cluster analysis identifies distinct types of metabolic dysfunction-associated steatotic liver disease,0,FALSE
10.1038/s41467-021-25734-w,115,2021,Evidence from a long-term experiment that collective risks change social norms and promote cooperation,0,FALSE
10.1111/add.14403,114,2018,Profiles of recovery from alcohol use disorder at three years following treatment: can the definition of recovery be extended to include high functioning heavy drinkers?,0,FALSE
10.1037/edu0000701,113,2021,Learning loss during the COVID-19 pandemic and the impact of emergency remote instruction on first grade students’ writing: A natural experiment.,0,FALSE
10.1016/j.jbtep.2018.07.002,113,2018,Trigger warning: Empirical evidence ahead,1,TRUE
10.1037/e578192014-061,113,2014,Free to punish: A motivated account of free will belief,0,FALSE
10.1073/pnas.1707040114,112,2017,Search predicts and changes patience in intertemporal choice,0,FALSE
10.1093/rof/rfv016,112,2015,Bubbling with Excitement: An Experiment,0,FALSE
10.1007/s12152-008-9015-7,111,2008,The Actor–Observer Bias and Moral Intuitions: Adding Fuel to Sinnott-Armstrong’s Fire,0,FALSE
10.1080/0958519032000114237,111,2003,International adjustment of female vs male business expatriates,0,FALSE
10.1038/s41467-018-06785-y,110,2018,Dopamine-dependent prefrontal reactivations explain long-term benefit of fear extinction,0,FALSE
10.1093/jos/ffr009,110,2012,Quantification and ACD: Evidence from Real-Time Sentence Processing,0,FALSE
10.1176/appi.ajp.159.3.443,110,2002,Are Cognitive Impairments Associated With Sensitivity to Stress in Schizophrenia? An Experience Sampling Study,0,FALSE
10.1016/s0005-7967(00)00036-x,110,2001,Brief cognitive therapy for social phobia: a case series,0,FALSE
10.1001/jamanetworkopen.2019.0570,110,2019,Association of Continuous Assessment of Step Count by Remote Monitoring With Disability Progression Among Adults With Multiple Sclerosis,0,FALSE
10.1097/brs.0b013e3181ed2de1,110,2010,Validation of DNA-Based Prognostic Testing to Predict Spinal Curve Progression in Adolescent Idiopathic Scoliosis,0,FALSE
10.1016/j.econedurev.2014.10.007,110,2014,How learning a musical instrument affects the development of skills,0,FALSE
10.1017/s0003055421000678,110,2021,Public Perceptions of Women’s Inclusion and Feelings of Political Efficacy,0,FALSE
10.1037/0022-3514.95.2.420,109,2008,"""Walking on eggshells"": How expressing relationship insecurities perpetuates them.",0,FALSE
10.1257/aer.101.4.1211,109,2011,Participation,0,FALSE
10.1093/hmg/ddp542,109,2009,Comprehensive follow-up of the first genome-wide association study of multiple sclerosis identifies KIF21B and TMEM39A as susceptibility loci,0,FALSE
10.1017/cbo9781139524575.009,109,1992,Evaluation of classroom interaction,0,FALSE
10.1016/j.compedu.2013.12.004,109,2013,Learning from video modeling examples: Effects of seeing the human model's face,0,FALSE
10.1145/2025113.2025141,109,2011,Semistructured merge,0,FALSE
10.1016/j.jesp.2020.104019,108,2020,Perceiving economic inequality in everyday life decreases tolerance to inequality,0,FALSE
10.1016/j.cognition.2014.09.006,107,2014,The drunk utilitarian: Blood alcohol concentration predicts utilitarian responses in moral dilemmas,0,FALSE
10.1111/psyp.12132,107,2013,Reliability of the<scp>ERN</scp>across multiple tasks as a function of increasing errors,0,FALSE
10.1017/s0008423903778810,107,2003,Does the Local Candidate Matter? Candidate Effects in the Canadian Election of 2000,0,FALSE
10.1901/jaba.2012.45-69,107,2012,EVALUATION OF A SELF‐INSTRUCTION PACKAGE FOR CONDUCTING STIMULUS PREFERENCE ASSESSMENTS,0,FALSE
10.1016/j.omtn.2018.01.003,107,2018,Association of Common Genetic Variants in Pre-microRNAs and Neuroblastoma Susceptibility: A Two-Center Study in Chinese Children,0,FALSE
10.1177/0146167211436117,107,2012,Your Love Lifts Me Higher! The Energizing Quality of Secure Relationships,0,FALSE
10.1037/a0027586,107,2012,ERN and the placebo: A misattribution approach to studying the arousal properties of the error-related negativity.,1,TRUE
10.1111/j.1467-9280.2008.02042.x,106,2008,Conflict-Triggered Goal Shielding,0,FALSE
10.1002/stvr.1594,106,2015,Predicting metamorphic relations for testing scientific software: a machine learning approach using graph kernels,0,FALSE
10.3945/jn.112.159319,106,2012,"Hippuric Acid in 24-Hour Urine Collections Is a Potential Biomarker for Fruit and Vegetable Consumption in Healthy Children and Adolescents,",0,FALSE
10.1111/j.1752-0606.1986.tb00673.x,106,1986,PREDICTING MARITAL SUCCESS WITH PREPARE: A PREDICTIVE VALIDITY STUDY,0,FALSE
10.1016/0145-2134(88)90073-7,106,1988,Child sexual abuse: Who is to blame?,0,FALSE
10.1080/17470910701563681,106,2008,Preliminary evidence for deficits in multisensory integration in autism spectrum disorders: The mirror neuron hypothesis,0,FALSE
10.1016/j.learninstruc.2018.04.006,105,2018,Fostering teenagers' assessment of information reliability: Effects of a classroom intervention focused on critical source dimensions,0,FALSE
10.1017/s0142716409990014,105,2009,Automatization in second language acquisition: What does the coefficient of variation tell us?,0,FALSE
10.2307/1128199,105,1976,Sex Differences: A Study of the Eye of the Beholder,0,FALSE
10.3758/s13423-014-0683-5,105,2014,Knowledge and luck,0,FALSE
10.1017/s0022381608080456,105,2008,Engaging the Unengaged Voter: Vote Centers and Voter Turnout,0,FALSE
10.1126/science.aaa3841,104,2015,Unlearning implicit social biases during sleep,1,TRUE
10.1177/00224669070410010201,103,2007,"Effects of Repeated Readings, Error Correction, and Performance Feedback on the Fluency and Comprehension of Middle School Students With Behavior Problems",0,FALSE
10.1037/pspp0000047,103,2015,Adolescent emotionality and effortful control: Core latent constructs and links to psychopathology and functioning.,0,FALSE
10.1111/bjop.12208,103,2016,Altruism predicts mating success in humans,0,FALSE
10.1080/02796015.2011.12087729,102,2011,Treatment Integrity of Interventions With Children in the School Psychology Literature from 1995 to 2008,0,FALSE
10.1126/science.abh4340,102,2022,RETRACTED: In vivo direct imaging of neuronal activity at high temporospatial resolution,0,FALSE
10.1177/0956797617702699,102,2017,Pupillary Responses to Words That Convey a Sense of Brightness or Darkness,0,FALSE
10.1002/hbm.20939,102,2010,A common mechanism for adaptive scaling of reward and novelty,0,FALSE
10.1901/jeab.2008.90-257,101,2008,"ASSOCIATIVE SYMMETRY, ANTISYMMETRY, AND A THEORY OF PIGEONS' EQUIVALENCE‐CLASS FORMATION",0,FALSE
10.1111/j.1467-9280.2008.02080.x,100,2008,A Motion Aftereffect From Still Photographs Depicting Motion,0,FALSE
10.4161/viru.1.5.12486,100,2010,"Detection of an infectious retrovirus, XMRV, in blood cells of patients with chronic fatigue syndrome",0,FALSE
10.1037/0278-7393.34.2.353,99,2008,Tracing attention and the activation flow in spoken word planning using eye movements.,0,FALSE
10.1080/01690960802250900,99,2008,A tale of two frequencies: Determining the speed of lexical access for Mandarin Chinese and English compounds,0,FALSE
10.1037/0021-843x.112.2.228,99,2003,"Is depression taxonic, dimensional, or both?",0,FALSE
10.1016/j.brainres.2009.07.042,99,2009,Does working memory capacity affect the ability to predict upcoming words in discourse?,0,FALSE
10.1016/j.poetic.2015.07.001,98,2015,The effects of reading material on social and non-social cognition,0,FALSE
10.1037/0021-843x.115.4.798,98,2006,Effects of comorbid psychopathy on criminal offending and emotion processing in male offenders with antisocial personality disorder.,0,FALSE
10.1037/a0036477,97,2014,Oral approach–avoidance: Affective consequences of muscular articulation dynamics.,0,FALSE
10.1177/0267658310395851,97,2011,Psycholinguistic word information in second language oral discourse,0,FALSE
10.1016/j.system.2013.03.004,97,2013,Oral corrective feedback on L2 writing: Two approaches compared,0,FALSE
10.1111/nous.12017,96,2013,"Knowledge, Stakes, and Mistakes",0,FALSE
10.1257/aer.102.2.720,96,2012,Slow to Anger and Fast to Forgive: Cooperation in an Uncertain World,1,TRUE
10.1177/1098300711398935,96,2011,Class-Wide Function-Related Intervention Teams: Effects of Group Contingency Programs in Urban Classrooms,0,FALSE
10.25300/misq/2020/14110,96,2020,Finding People with Emotional Distress in Online Social Media: A Design Combining Machine Learning and Rule-Based Classification,0,FALSE
10.1016/j.system.2008.08.002,96,2009,Implicit attitudes towards native and non-native speaker teachers,0,FALSE
10.1037/a0027598,95,2012,The physical burdens of secrecy.,0,FALSE
10.1073/pnas.1516868113,95,2016,Hiding personal information reveals the worst,0,FALSE
10.1177/0956797615623770,95,2016,Discouraged by Peer Excellence,0,FALSE
10.1016/j.cognition.2017.02.010,95,2017,Sequential congruency effects reveal differences in disengagement of attention for monolingual and bilingual young adults,0,FALSE
10.1016/j.compedu.2014.04.009,95,2014,An analysis of variables affecting the ICT literacy level of Korean elementary school students,0,FALSE
10.1037/0022-3514.94.1.48,94,2008,1/f noise and effort on implicit measures of bias.,0,FALSE
10.1037/a0012833,94,2008,Increasing and decreasing motor and cognitive output: A model of general action and inaction goals.,1,TRUE
10.1177/0956797611434540,94,2012,A Choice Mind-Set Increases the Acceptance and Maintenance of Wealth Inequality,0,FALSE
10.1177/0956797618806296,94,2018,You That Read Wrong Again! A Transposed-Word Effect in Grammaticality Judgments,1,TRUE
10.3138/cmlr.3831,94,2018,Task-Based Language Teaching for Beginner-Level Learners of L2 French: An Exploratory Study,0,FALSE
10.1007/s12110-004-1010-z,94,2004,Romantic jealousy in early adulthood and in later life,2,TRUE
10.1145/3379597.3387482,94,2020,What is the Vocabulary of Flaky Tests?,0,FALSE
10.1002/jae.1118,94,2009,Measuring the diffusion of housing prices across space and over time,0,FALSE
10.1016/j.cognition.2015.01.013,93,2015,Causal superseding,0,FALSE
10.1037/0022-3514.95.2.274,93,2008,"Self-handicapping, excuse making, and counterfactual thinking: Consequences for self-esteem and future motivation.",0,FALSE
10.1210/jc.2009-0545,93,2009,Predictors of Pregnancy in Women with Polycystic Ovary Syndrome,0,FALSE
10.1093/aesthj/ayu027,92,2014,Empirically Investigating Imaginative Resistance,0,FALSE
10.1111/0023-8333.00112,92,2000,"The Validation of Three Scales Measuring Anxiety at Different Stages of the Foreign Language Learning Process: The Input Anxiety Scale, the Processing Anxiety Scale, and the Output Anxiety Scale",0,FALSE
10.2139/ssrn.1246696,92,2007,The Making of the Millennium Development Goals: Human Development Meets Results-Based Management in an Imperfect World,0,FALSE
10.1037/xhp0000399,92,2017,Global ensemble texture representations are critical to rapid scene perception.,0,FALSE
10.1136/jnnp.2004.047357,92,2005,Effect of posture on levels of arousal and awareness in vegetative and minimally conscious state patients: a preliminary investigation,0,FALSE
10.1037/pspp0000136,92,2017,The incremental validity of average state self-reports over global self-reports of personality.,0,FALSE
10.1080/01690965.2011.622905,92,2012,Predictive processing of syntactic structure: Sluicing and ellipsis in real-time sentence processing,0,FALSE
10.1145/2702123.2702593,92,2015,Interruptibility of Software Developers and its Prediction Using Psycho-Physiological Sensors,0,FALSE
10.1111/j.1467-9280.2008.02046.x,91,2008,"Temporal Selection is Suppressed, Delayed, and Diffused During the Attentional Blink",0,FALSE
10.1016/j.cedpsych.2017.07.002,91,2017,Learning executive function skills by playing focused video games,0,FALSE
10.1097/00003446-200210000-00007,91,2002,Recognition of Lexically Controlled Words and Sentences by Children with Normal Hearing and Children with Cochlear Implants,0,FALSE
10.1002/jaba.27,91,2013,EXPERIMENTAL ANALYSIS OF PRECURSORS TO SEVERE PROBLEM BEHAVIOR,0,FALSE
10.1111/j.1365-2982.2012.01937.x,91,2012,Intestinal aganglionosis is associated with early and sustained disruption of the colonic microbiome,0,FALSE
10.1007/bf00431763,91,1981,The alcohol facilitation effect on memory: A dose-response study,0,FALSE
10.1016/j.neuropsychologia.2009.05.011,90,2009,Neural mechanisms of attentional shifts due to irrelevant spatial and numerical cues,0,FALSE
10.1037/a0034462,90,2013,A functional basis for structure-seeking: Exposure to structure promotes willingness to engage in motivated action.,0,FALSE
10.1111/lang.12353,90,2019,More Than Frequency? Exploring Predictors of Word Difficulty for Second Language Learners,0,FALSE
10.1162/jocn_a_00801,90,2015,Changes in Theta and Beta Oscillations as Signatures of Novel Word Consolidation,0,FALSE
10.1037/a0018144,90,2010,How prevalent is wishful thinking? Misattribution of arousal causes optimism and pessimism in subjective probabilities.,0,FALSE
10.1177/0146167214524992,89,2014,My Mother and Me,1,TRUE
10.1177/0956797616662271,89,2016,Your Understanding Is My Understanding,0,FALSE
10.1002/jclp.22191,89,2015,Trajectories of Change in Psychotherapy,0,FALSE
10.1093/applin/amv060,89,2015,"The Impact of Out-of-School Factors on Motivation to Learn English: Self-discrepancies, Beliefs, and Experiences of Self-authenticity",0,FALSE
10.1086/298261,89,1991,"""Overeducation"" in the Labor Market",0,FALSE
10.1037/0278-7393.34.3.495,88,2008,On the additive effects of stimulus quality and word frequency in lexical decision: Evidence for opposing interactive influences revealed by RT distributional analyses.,0,FALSE
10.1111/j.1467-9280.2008.02092.x,88,2008,Perceptual Mechanisms That Characterize Gender Differences in Decoding Women's Sexual Intent,1,TRUE
10.1177/0956797619854706,88,2019,Challenging Moral Attitudes With Moral Messages,0,FALSE
10.1007/bf01541644,88,1994,Creating impressions: An experimental investigation of political advertising on television,0,FALSE
10.1002/smr.1838,88,2016,There and back again: Can you compile that snapshot?,0,FALSE
10.1177/0146167212475225,88,2013,Intention Invention and the Affect Misattribution Procedure,0,FALSE
10.1111/jofi.12619,88,2018,What Makes a Good Trader? On the Role of Reflection and Intuition on Trader Performance,0,FALSE
10.1007/s10649-021-10072-x,88,2021,Teaching mathematics with technology: a multidimensional analysis of teacher beliefs,0,FALSE
10.1002/acp.2874,87,2012,Paranormal and Religious Believers Are More Prone to Illusory Face Perception than Skeptics and Non‐believers,0,FALSE
10.1073/pnas.2022819118,87,2021,Testing the effects of Facebook usage in an ethnically polarized setting,0,FALSE
10.1016/j.ecresq.2008.08.002,87,2008,An intervention for relational and physical aggression in early childhood: A preliminary study,0,FALSE
10.1016/j.beth.2012.02.002,87,2012,Incremental Benefits of a Daily Report Card Intervention Over Time for Youth With Disruptive Behavior,0,FALSE
10.1177/0956797616689092,87,2017,Thinking Fast Increases Framing Effects in Risky Decision Making,0,FALSE
10.1016/j.jsams.2016.12.076,87,2017,Asymmetry during preseason Functional Movement Screen testing is associated with injury during a junior Australian football season,0,FALSE
10.64152/10125/66632,87,2009,The effects of cultural familiarity on reading comprehension,0,FALSE
10.1007/s10803-013-1829-4,86,2013,The Effects of a Multi-Component Higher-Functioning Autism Anti-Stigma Program on Adolescent Boys,0,FALSE
10.1177/1098300712440453,86,2012,The Effects of Self-Monitoring on Teachers’ Use of Specific Praise,0,FALSE
10.1111/j.1530-0277.2006.00265.x,86,2006,Impact of Age at First Drink on Stress‐Reactive Drinking,0,FALSE
10.1037/0096-1523.34.2.340,86,2008,"Cognitive control: Dynamic, sustained, and voluntary influences.",0,FALSE
10.1037/xge0001120,86,2021,"Of pandemics, politics, and personality: The role of conscientiousness and political ideology in the sharing of fake news.",0,FALSE
10.1111/j.1467-9280.1995.tb00312.x,86,1995,The Price of Expertise: Effects of Experience on the Water-Level Task,0,FALSE
10.1111/j.1467-9280.2009.02447.x,85,2009,Asymmetrical Body Perception,0,FALSE
10.1016/j.lindif.2016.03.001,85,2016,A relational frame skills training intervention to increase general intelligence and scholastic aptitude,0,FALSE
10.1145/3105726.3106182,84,2017,Investigating Static Analysis Errors in Student Java Programs,0,FALSE
10.1111/j.1467-9280.2008.02078.x,83,2008,Nonconscious Goal Pursuit in Novel Environments,0,FALSE
10.1016/j.ijgo.2006.07.013,83,2006,A risk reduction strategy to prevent maternal deaths associated with unsafe abortion,0,FALSE
10.1038/srep05304,83,2014,Is ostension any more than attention?,0,FALSE
10.1097/00001888-197307000-00003,83,1973,The Doctor Fox Lecture,1,TRUE
10.1093/her/cyl160,82,2007,Beyond Good Intentions: the development and evaluation of a proactive self-management course for patients recently diagnosed with Type 2 diabetes,0,FALSE
10.1177/0956797618779061,82,2018,In Defense of the Commons: Young Children Negatively Evaluate and Sanction Free Riders,0,FALSE
10.1519/jsc.0000000000002981,82,2018,Effects of Preferred vs. Nonpreferred Music on Resistance Exercise Performance,0,FALSE
