doi,cited_by_count,publication_year,title,n_pages,found_on_wiki
10.1037/h0054651,18245,1935,Studies of interference in serial verbal reactions.,8,TRUE
10.1126/science.7455683,17193,1981,The Framing of Decisions and the Psychology of Choice,10,TRUE
10.4159/9780674369542,13386,2014,Capital in the Twenty-First Century,1,TRUE
10.1016/s1386-4181(01)00024-6,10217,2002,Illiquidity and stock returns: cross-section and time-series effects,0,FALSE
10.1016/0010-0285(73)90033-9,9872,1973,Availability: A heuristic for judging frequency and probability,12,TRUE
10.1111/j.1083-6101.2007.00367.x,9796,2007,The Benefits of Facebook “Friends:” Social Capital and College Students’ Use of Online Social Network Sites,8,TRUE
10.2307/3250921,8150,2001,Understanding Information Systems Continuance: An Expectation-Confirmation Model1,1,TRUE
10.1037/0033-295x.84.4.327,7256,1977,Features of similarity.,2,TRUE
10.1080/009262300278597,6431,2000,The Female Sexual Function Index (FSFI): A Multidimensional Self-Report Instrument for the Assessment of Female Sexual Function,1,TRUE
10.1002/(sici)1097-0266(199704)18:4<303::aid-smj869>3.0.co;2-g,6363,1997,THE CORPORATE SOCIAL PERFORMANCE-FINANCIAL PERFORMANCE LINK,0,FALSE
10.1037/0003-066x.60.5.410,5854,2005,Positive Psychology Progress: Empirical Validation of Interventions.,1,TRUE
10.1016/s0272-4944(05)80184-7,5590,1991,Stress recovery during exposure to natural and urban environments,2,TRUE
10.1037/0022-3514.58.6.1015,5499,1990,A focus theory of normative conduct: Recycling the concept of norms to reduce littering in public places.,2,TRUE
10.1111/1540-6237.8402002,5449,2003,Social Vulnerability to Environmental Hazards<sup>*</sup>,2,TRUE
10.1016/0304-3932(89)90047-0,5367,1989,Is public expenditure productive?,1,TRUE
10.1037/0012-1649.43.6.1428,5290,2007,School readiness and later achievement.,1,TRUE
10.1016/j.biopsych.2006.03.040,4956,2006,The Prevalence and Correlates of Eating Disorders in the National Comorbidity Survey Replication,0,FALSE
10.1016/0167-2681(82)90011-7,4872,1982,An experimental analysis of ultimatum bargaining,4,TRUE
10.1037/h0040525,4807,1963,Behavioral Study of obedience.,19,TRUE
10.1038/ng.2802,4629,2013,"Meta-analysis of 74,046 individuals identifies 11 new susceptibility loci for Alzheimer's disease",3,TRUE
10.1016/b978-0-12-205050-3.50008-7,4363,1974,Does Economic Growth Improve the Human Lot? Some Empirical Evidence,0,FALSE
10.1111/j.1540-4781.1986.tb05256.x,4216,1986,Foreign Language Classroom Anxiety,1,TRUE
10.1037/h0093718,4211,1956,Studies of independence and conformity: I. A minority of one against a unanimous majority.,5,TRUE
10.1093/pan/mpr057,4061,2012,Evaluating Online Labor Markets for Experimental Research: Amazon.com's Mechanical Turk,0,FALSE
10.1038/nature01960,3755,2003,Small molecule activators of sirtuins extend Saccharomyces cerevisiae lifespan,1,TRUE
10.1111/j.1467-8624.2007.00995.x,3696,2007,Implicit Theories of Intelligence Predict Achievement Across an Adolescent Transition: A Longitudinal Study and an Intervention,4,TRUE
10.1038/nm.2753,3689,2012,Melanoma exosomes educate bone marrow progenitor cells toward a pro-metastatic phenotype through MET,1,TRUE
10.1037/0022-3514.76.6.893,3588,1999,The chameleon effect: The perception–behavior link and social interaction.,9,TRUE
10.1126/science.198.4312.75,3220,1977,Imitation of Facial and Manual Gestures by Human Neonates,0,FALSE
10.1016/0022-1031(77)90049-x,3173,1977,The “false consensus effect”: An egocentric bias in social perception and attribution processes,3,TRUE
10.1037/0033-295x.93.2.136,3032,1986,Norm theory: Comparing reality to its alternatives.,3,TRUE
10.1037/1040-3590.14.4.485,2954,2002,The Obsessive-Compulsive Inventory: Development and validation of a short version.,2,TRUE
10.1080/00208825.1980.11656300,2947,1980,Culture and Organizations,0,FALSE
10.1016/0010-0285(83)90002-6,2929,1983,Schema induction and analogical transfer,1,TRUE
10.1016/j.jfineco.2004.06.007,2887,2005,Asset pricing with liquidity risk,2,TRUE
10.1126/science.1238041,2864,2013,Poverty Impedes Cognitive Function,4,TRUE
10.1016/j.cell.2011.08.017,2828,2011,BET Bromodomain Inhibition as a Therapeutic Strategy to Target c-Myc,1,TRUE
10.1016/s0165-1765(01)00394-9,2794,2001,Are people conditionally cooperative? Evidence from a public goods experiment,1,TRUE
10.1002/(sici)1099-0771(200001/03)13:1<1::aid-bdm333>3.0.co;2-s,2789,2000,The affect heuristic in judgments of risks and benefits,0,FALSE
10.1162/003355302320935025,2700,2002,Reversal of Fortune: Geography and Institutions in the Making of the Modern World Income Distribution,2,TRUE
10.1523/jneurosci.14-05-03208.1994,2662,1994,Adaptive representation of dynamics during learning of a motor task,0,FALSE
10.1016/s0883-9026(96)00003-1,2599,1997,Differences between entrepreneurs and managers in large organizations: Biases and heuristics in strategic decision-making,0,FALSE
10.1038/nature11005,2545,2012,Systematic identification of genomic markers of drug sensitivity in cancer cells,1,TRUE
10.1038/nature01647,2515,2003,Action video game modifies visual selective attention,5,TRUE
10.1509/jmkg.73.3.052,2473,2009,Brand Experience: What is It? How is it Measured? Does it Affect Loyalty?,2,TRUE
10.1037/h0055756,2468,1946,Forming impressions of personality.,6,TRUE
10.1086/511799,2425,2007,Getting a Job: Is There a Motherhood Penalty?,10,TRUE
10.1016/0010-0277(86)90010-7,2402,1986,Referring as a collaborative process,2,TRUE
10.1037/0022-3514.71.2.230,2394,1996,Automaticity of social behavior: Direct effects of trait construct and stereotype activation on action.,7,TRUE
10.1038/nature09144,2375,2010,A coding-independent function of gene and pseudogene mRNAs regulates tumour biology,3,TRUE
10.1073/pnas.1516047113,2361,2016,"Racial bias in pain assessment and treatment recommendations, and false beliefs about biological differences between blacks and whites",11,TRUE
10.18653/v1/2020.findings-emnlp.139,2358,2020,CodeBERT: A Pre-Trained Model for Programming and Natural Languages,0,FALSE
10.1126/science.1107621,2333,2005,Do 15-Month-Old Infants Understand False Beliefs?,3,TRUE
10.3758/bf03196313,2327,2002,Grounding language in action,1,TRUE
10.1038/ng1732,2271,2006,Variant of transcription factor 7-like 2 (TCF7L2) gene confers risk of type 2 diabetes,2,TRUE
10.1038/ng.439,2263,2009,Genome-wide association study identifies variants at CLU and CR1 associated with Alzheimer's disease,3,TRUE
10.1037/0022-3514.75.1.5,2252,1998,The role of feasibility and desirability considerations in near and distant future decisions: A test of temporal construal theory.,3,TRUE
10.1016/s2213-8587(18)30051-2,2243,2018,Novel subgroups of adult-onset diabetes and their association with outcomes: a data-driven cluster analysis of six variables,0,FALSE
10.1038/ng.520,2225,2010,New genetic loci implicated in fasting glucose homeostasis and their impact on type 2 diabetes risk,1,TRUE
10.1126/science.1224820,2201,2012,Intestinal Inflammation Targets Cancer-Inducing Activity of the Microbiota,2,TRUE
10.1017/s0272263197001034,2199,1997,CORRECTIVE FEEDBACK AND LEARNER UPTAKE,2,TRUE
10.1038/nm.4246,2197,2016,Resting-state connectivity biomarkers define neurophysiological subtypes of depression,0,FALSE
10.1257/aer.101.7.3221,2151,2011,The Slave Trade and the Origins of Mistrust in Africa,2,TRUE
10.3982/ecta13408,2134,2015,Identification Properties of Recent Production Function Estimators,0,FALSE
10.1016/0030-5073(76)90005-2,2072,1976,Knee-deep in the big muddy: a study of escalating commitment to a chosen course of action,2,TRUE
10.1101/gr.126516.111,2034,2011,<i>Fusobacterium nucleatum</i> infection is prevalent in human colorectal carcinoma,2,TRUE
10.1016/s0022-4359(00)00035-x,2013,2000,E-satisfaction: an initial examination,0,FALSE
10.1037/pspp0000096,1999,2016,"The next Big Five Inventory (BFI-2): Developing and assessing a hierarchical model with 15 facets to enhance bandwidth, fidelity, and predictive power.",1,TRUE
10.1016/0001-6918(81)90005-6,1994,1981,Are we all less risky and more skillful than our fellow drivers?,5,TRUE
10.1126/science.1091721,1986,2003,Medicine. Do defaults save lives?,4,TRUE
10.1037/a0012840,1975,2008,Engagement and disaffection in the classroom: Part of a larger motivational dynamic?,0,FALSE
10.1016/j.ccr.2010.01.020,1971,2010,The Common Feature of Leukemia-Associated IDH1 and IDH2 Mutations Is a Neomorphic Enzyme Activity Converting α-Ketoglutarate to 2-Hydroxyglutarate,3,TRUE
10.1038/nature10860,1958,2012,IDH mutation impairs histone demethylation and results in a block to cell differentiation,2,TRUE
10.1126/science.1168450,1932,2009,Self-Control in Decision-Making Involves Modulation of the vmPFC Valuation System,1,TRUE
10.1086/208911,1925,1982,Reference Group Influence on Product and Brand Purchase Decisions,0,FALSE
10.1111/j.1540-6261.2007.01207.x,1895,2007,Whom You Know Matters: Venture Capital Networks and Investment Performance,0,FALSE
10.1016/0010-0285(92)90013-r,1879,1992,The weighing of evidence and the determinants of confidence,0,FALSE
10.1016/j.cub.2004.01.029,1841,2004,The Ventriloquist Effect Results from Near-Optimal Bimodal Integration,2,TRUE
10.1016/s0010-0277(99)00073-6,1824,2000,Metaphoric structuring: understanding time through spatial metaphors,2,TRUE
10.1037/0022-3514.81.6.1014,1816,2001,The automated will: Nonconscious activation and pursuit of behavioral goals.,3,TRUE
10.1037/0022-3514.54.5.768,1802,1988,Inhibiting and facilitating conditions of the human smile: A nonobtrusive test of the facial feedback hypothesis.,6,TRUE
10.1038/ncb2048,1783,2010,Wnt activity defines colon cancer stem cells and is regulated by the microenvironment,0,FALSE
10.1037/0096-1523.1.3.288,1767,1975,Hindsight is not equal to foresight: The effect of outcome knowledge on judgment under uncertainty.,4,TRUE
10.1126/science.167.3914.86,1759,1970,Chimpanzees: Self-Recognition,9,TRUE
10.1207/s15326985ep3902_1,1740,2004,"Why Isn't Creativity More Important to Educational Psychologists? Potentials, Pitfalls, and Future Directions in Creativity Research",0,FALSE
10.1056/nejmoa073493,1732,2007,Risk Alleles for Multiple Sclerosis Identified by a Genomewide Study,0,FALSE
10.1177/0956797620939054,1725,2020,Fighting COVID-19 Misinformation on Social Media: Experimental Evidence for a Scalable Accuracy-Nudge Intervention,1,TRUE
10.1016/j.neuroimage.2013.05.039,1700,2013,Resting-state fMRI in the Human Connectome Project,2,TRUE
10.1111/j.2044-8295.1975.tb01468.x,1684,1975,CONTEXT‐DEPENDENT MEMORY IN TWO NATURAL ENVIRONMENTS: ON LAND AND UNDERWATER,8,TRUE
10.1192/bjp.129.2.125,1676,1976,The Influence of Family and Social Factors on the Course of Psychiatric Illness,0,FALSE
10.1073/pnas.1121623109,1643,2012,The CD47-signal regulatory protein alpha (SIRPa) interaction is a therapeutic target for human solid tumors,1,TRUE
10.1126/science.1150952,1641,2008,Spending Money on Others Promotes Happiness,4,TRUE
10.1038/ng2048,1623,2007,Variation in FTO contributes to childhood obesity and severe adult obesity,1,TRUE
10.1038/nature08833,1622,2010,RAF inhibitors prime wild-type RAF to activate the MAPK pathway and enhance growth,2,TRUE
10.1038/nature06014,1612,2007,Genetic variants regulating ORMDL3 expression contribute to the risk of childhood asthma,2,TRUE
10.1017/s0140525x07001185,1588,2007,The Parieto-Frontal Integration Theory (P-FIT) of intelligence: Converging neuroimaging evidence,1,TRUE
10.1016/j.cell.2012.08.026,1566,2012,Transcriptional Amplification in Tumor Cells with Elevated c-Myc,2,TRUE
10.1126/science.1239918,1564,2013,Reading Literary Fiction Improves Theory of Mind,3,TRUE
10.1038/s41562-018-0399-z,1551,2018,Evaluating the replicability of social science experiments in Nature and Science between 2010 and 2015,3,TRUE
10.1037/0022-3514.84.6.1236,1549,2003,The do re mi's of everyday life: The structure and personality correlates of music preferences.,3,TRUE
10.2307/256894,1547,1998,INTERNATIONAL EXPANSION THROUGH START-UP OR ACQUISITION: A LEARNING PERSPECTIVE.,0,FALSE
10.1037/0022-3514.37.10.1660,1546,1979,The role of category accessibility in the interpretation of information about persons: Some determinants and implications.,1,TRUE
10.1038/nature06288,1540,2007,Social evaluation by preverbal infants,2,TRUE
10.1126/science.1207745,1516,2011,Google Effects on Memory: Cognitive Consequences of Having Information at Our Fingertips,4,TRUE
10.1038/nature10509,1513,2011,Inhibition of BET recruitment to chromatin as an effective treatment for MLL-fusion leukaemia,1,TRUE
10.1126/science.1222426,1512,2012,Some Consequences of Having Too Little,0,FALSE
10.3758/s13428-021-01694-3,1494,2021,Data quality of platforms and panels for online behavioral research,0,FALSE
10.1016/j.cell.2009.12.040,1462,2010,Kinase-Dead BRAF and Oncogenic RAS Cooperate to Drive Tumor Progression through CRAF,0,FALSE
10.1037/a0020092,1458,2010,"Having less, giving more: The influence of social class on prosocial behavior.",4,TRUE
10.1038/nature09627,1446,2010,COT drives resistance to RAF inhibition through MAP kinase pathway reactivation,0,FALSE
10.1037/0022-0663.91.2.358,1439,1999,Cognitive principles of multimedia learning: The role of modality and contiguity.,2,TRUE
10.1037/0003-066x.54.6.408,1436,1999,The origins of sex differences in human behavior: Evolved dispositions versus social roles.,6,TRUE
10.1177/0146167299025002007,1433,1999,Consequences of Automatic Evaluation: Immediate Behavioral Predispositions to Approach or Avoid the Stimulus,1,TRUE
10.1126/science.1162548,1420,2008,Experiencing Physical Warmth Promotes Interpersonal Warmth,3,TRUE
10.1037/1076-8998.5.3.347,1419,2000,"Perceptions of safety at work: A framework for linking safety climate to safety performance, knowledge, and motivation.",0,FALSE
10.1177/0956797611418350,1415,2011,Emotion-Regulation Choice,1,TRUE
10.1037/0278-7393.4.1.19,1411,1978,Semantic integration of verbal information into a visual memory.,2,TRUE
10.1038/nm.2284,1404,2011,The microRNA miR-34a inhibits prostate cancer stem cells and metastasis by directly repressing CD44,2,TRUE
10.1080/17470215908416289,1396,1959,Attention in Dichotic Listening: Affective Cues and the Influence of Instructions,5,TRUE
10.1016/0030-5073(84)90043-6,1390,1984,"A test of leadership categorization theory: Internal structure, information processing, and leadership perceptions",0,FALSE
10.1037/0022-3514.89.3.277,1378,2005,An inkblot for attitudes: Affect misattribution as implicit measurement.,4,TRUE
10.2307/2585837,1378,2000,"The Effects of Canvassing, Telephone Calls, and Direct Mail on Voter Turnout: A Field Experiment",2,TRUE
10.1038/nature11467,1369,2012,Spontaneous giving and calculated greed,2,TRUE
10.1038/nature09557,1369,2010,Tumour vascularization via endothelial differentiation of glioblastoma stem-like cells,0,FALSE
10.1111/1467-9280.00111,1357,1999,Stereotype Susceptibility: Identity Salience and Shifts in Quantitative Performance,2,TRUE
10.1126/science.1132491,1340,2006,The Psychological Consequences of Money,1,TRUE
10.1038/ng.485,1336,2009,Genome-wide association study identifies common variants at four loci as genetic risk factors for Parkinson's disease,2,TRUE
10.5465/amj.2005.18803920,1330,2005,Unbundling the Structure of Inertia: Resource Versus Routine Rigidity,0,FALSE
10.1002/smj.807,1320,2009,"Innovation objectives, knowledge sources, and the benefits of breadth",0,FALSE
10.1038/ng.81,1299,2008,"Genome-wide association scan in women with systemic lupus erythematosus identifies susceptibility variants in ITGAM, PXK, KIAA1542 and other loci",2,TRUE
10.1177/0146167202286008,1283,2002,The Bias Blind Spot: Perceptions of Bias in Self Versus Others,4,TRUE
10.1111/j.1467-9280.2006.01824.x,1254,2006,Power and Perspectives Not Taken,1,TRUE
10.1001/jama.2010.574,1250,2010,Genome-wide Analysis of Genetic Loci Associated With Alzheimer Disease,2,TRUE
10.1016/j.jom.2014.11.002,1250,2014,Firm's resilience to supply chain disruptions: Scale development and empirical examination,1,TRUE
10.1126/science.283.5398.77,1248,1999,Rule Learning by Seven-Month-Old Infants,1,TRUE
10.1073/pnas.1618923114,1234,2017,Emotion shapes the diffusion of moralized content in social networks,2,TRUE
10.1016/j.cognition.2007.11.004,1228,2008,Cognitive load selectively interferes with utilitarian moral judgment,2,TRUE
10.1038/nn1504,1216,2005,Probabilistic word pre-activation during language comprehension inferred from electrical brain activity,0,FALSE
10.1037/0012-1649.26.6.978,1215,1990,Predicting adolescent cognitive and self-regulatory competencies from preschool delay of gratification: Identifying diagnostic conditions.,3,TRUE
10.1257/aer.104.9.2593,1215,2014,Measuring the Impacts of Teachers I: Evaluating Bias in Teacher Value-Added Estimates,1,TRUE
10.1126/science.1177067,1199,2009,Promoting Interest and Performance in High School Science Classes,0,FALSE
10.1038/365611a0,1197,1993,Music and spatial task performance,3,TRUE
10.1371/journal.pone.0089642,1168,2014,The Musicality of Non-Musicians: An Index for Assessing Musical Sophistication in the General Population,0,FALSE
10.1111/j.1467-9280.2006.01720.x,1155,2006,Numeracy and Decision Making,0,FALSE
10.2307/1412188,1151,1898,The Dynamogenic Factors in Pacemaking and Competition,4,TRUE
10.1037/0022-3514.77.4.785,1147,1999,"Deviance or uniqueness, harmony or conformity? A cultural analysis.",1,TRUE
10.1037/h0062326,1146,1951,"Deviation, rejection, and communication.",2,TRUE
10.1016/j.jenvp.2005.07.001,1145,2005,Exposure to restorative environments helps restore attentional capacity,1,TRUE
10.1111/j.1467-9280.2006.01705.x,1140,2006,Gratitude and Prosocial Behavior,2,TRUE
10.1126/science.1130726,1134,2006,Washing Away Your Sins: Threatened Morality and Physical Cleansing,4,TRUE
10.1177/0022487108328155,1129,2008,Effects of Video Club Participation on Teachers' Professional Vision,0,FALSE
10.1111/j.1467-9280.2007.01983.x,1126,2007,God Is Watching You,1,TRUE
10.1017/s0272263100015047,1126,1996,The Influence of Planning and Task Type on Second Language Performance,0,FALSE
10.3928/0048-5713-19951201-07,1111,1995,The Formation of False Memories,5,TRUE
10.1037/a0035663,1101,2014,The essence of innocence: Consequences of dehumanizing Black children.,3,TRUE
10.1073/pnas.0910967107,1090,2010,Female teachers’ math anxiety affects girls’ math achievement,1,TRUE
10.1371/journal.pone.0016782,1081,2011,Metaphors We Think With: The Role of Metaphor in Reasoning,4,TRUE
10.1016/0010-0285(92)90008-p,1078,1992,Children's acquisition of the number words and the counting system,0,FALSE
10.1038/ng.3434,1072,2015,Genetic association analyses implicate aberrant regulation of innate and adaptive immunity genes in the pathogenesis of systemic lupus erythematosus,0,FALSE
10.1126/science.1183057,1071,2010,Coadministration of a Tumor-Penetrating Peptide Enhances the Efficacy of Cancer Drugs,2,TRUE
10.1126/science.1128317,1062,2006,Reducing the Racial Achievement Gap: A Social-Psychological Intervention,2,TRUE
10.1111/j.1467-9280.2007.01944.x,1053,2007,Action Anticipation Through Attribution of False Belief by 2-Year-Olds,0,FALSE
10.1056/nejmoa0903753,1051,2009,Genomewide Association Study of Leprosy,0,FALSE
10.1037/0033-295x.114.2.245,1046,2007,Word learning as Bayesian inference.,0,FALSE
10.1038/nm.3466,1043,2014,Plasma phospholipids identify antecedent memory impairment in older adults,0,FALSE
10.1016/j.cell.2011.09.029,1041,2011,Coding-Independent Regulation of the Tumor Suppressor PTEN by Competing Endogenous mRNAs,2,TRUE
10.1016/0022-1031(91)90011-t,1035,1991,Omission and commission in judgment and choice,0,FALSE
10.1038/nature01930,1034,2003,Dissociable stages of human memory consolidation and reconsolidation,2,TRUE
10.1126/science.1217697,1030,2012,ApoE-Directed Therapeutics Rapidly Clear β-Amyloid and Reverse Deficits in AD Mouse Models,2,TRUE
10.1006/cogp.1998.0708,1028,1999,Goals as Reference Points,1,TRUE
10.1111/j.1745-6916.2006.00007.x,1028,2006,A Theory of Unconscious Thought,4,TRUE
10.1038/nature09208,1026,2010,Diverse somatic mutation patterns and pathway alterations in human cancers,1,TRUE
10.1037/0022-3514.49.6.1621,1021,1985,Global self-evaluation as determined by the desirability and controllability of trait adjectives.,3,TRUE
10.1126/science.1123633,1017,2006,The Competitive Advantage of Sanctioning Institutions,1,TRUE
10.1073/pnas.1118373109,1014,2012,Higher social class predicts increased unethical behavior,2,TRUE
10.1162/jocn.2009.21282,1011,2009,"Patterns of Brain Activity Supporting Autobiographical Memory, Prospection, and Theory of Mind, and Their Relationship to the Default Mode Network",0,FALSE
10.1287/orsc.1040.0065,1002,2004,"Friends or Strangers? Firm-Specific Uncertainty, Market Uncertainty, and Network Partner Selection",0,FALSE
10.1177/0956797614524581,998,2014,The Pen Is Mightier Than the Keyboard,4,TRUE
10.1073/pnas.1113380109,997,2012,"At 6–9 months, human infants know the meanings of many common nouns",2,TRUE
10.1162/qjec.121.1.73,997,2007,Disease and Development: Evidence from Hookworm Eradication in the American South,10,TRUE
10.1002/smj.2268,987,2014,The impact of corporate social responsibility on investment recommendations: Analysts' perceptions and shifting institutional logics,0,FALSE
10.1016/j.obhdp.2006.01.005,983,2006,Sympathy and callousness: The impact of deliberative thought on donations to identifiable and statistical victims,3,TRUE
10.2307/20159604,981,2004,INTERNATIONAL DIVERSIFICATION AND FIRM PERFORMANCE: THE S-CURVE HYPOTHESIS.,0,FALSE
10.1037/0022-3514.81.1.33,978,2001,Moral credentials and the expression of prejudice.,3,TRUE
10.1126/science.1199327,975,2011,Retrieval Practice Produces More Learning than Elaborative Studying with Concept Mapping,1,TRUE
10.1073/pnas.0801030105,975,2008,FOXO3A genotype is strongly associated with human longevity,3,TRUE
10.1080/00140139608964474,959,1996,Trust in automation. Part II. Experimental studies of trust and human intervention in a process control simulation,0,FALSE
10.5840/philtopics2001291/217,949,2001,Normativity and Epistemic Intuitions,3,TRUE
10.1177/0956797612446024,943,2012,Inspired by Distraction,2,TRUE
10.1371/journal.pone.0175799,932,2017,Neutralizing misinformation through inoculation: Exposing misleading argumentation techniques reduces their influence,5,TRUE
10.1111/j.1467-7687.2004.00351.x,932,2004,Attention and inhibition in bilingual children: evidence from the dimensional change card sort task,1,TRUE
10.1037/0022-3514.83.1.44,929,2002,"Math = male, me = female, therefore math ≠ me.",3,TRUE
10.1001/jama.2015.8950,929,2015,Association of Electronic Cigarette Use With Initiation of Combustible Tobacco Product Smoking in Early Adolescence,0,FALSE
10.1037/0022-3514.73.4.733,922,1997,"Development of prosocial, individualistic, and competitive orientations: Theory and preliminary evidence.",2,TRUE
10.1016/j.earlhumdev.2003.12.002,922,2004,"2nd to 4th digit ratios, fetal testosterone and estradiol",1,TRUE
10.1126/science.1190792,918,2010,The Social Sense: Susceptibility to Others’ Beliefs in Human Infants and Adults,2,TRUE
10.1037/a0021524,916,2011,Feeling the future: Experimental evidence for anomalous retroactive influences on cognition and affect.,4,TRUE
10.1177/0956797612449177,914,2012,The Moral Roots of Environmental Attitudes,2,TRUE
10.1016/0010-0285(72)90003-5,913,1972,Sentence memory: A constructive versus interpretive approach,0,FALSE
10.1111/jofi.12698,909,2018,Anticompetitive Effects of Common Ownership,2,TRUE
10.1111/j.1467-9280.2006.01704.x,908,2006,The Anchoring-and-Adjustment Heuristic,3,TRUE
10.1016/j.jom.2007.08.002,904,2007,The impact of power and relationship commitment on the integration between manufacturers and customers in a supply chain,0,FALSE
10.1121/1.1894649,902,1991,Training Japanese listeners to identify English /r/ and /l/: A first report,2,TRUE
10.5465/amj.2014.0424,890,2015,Doing More with Less: Innovation Input and Output in Family Firms,0,FALSE
10.1098/rsos.160384,885,2016,The natural selection of bad science,3,TRUE
10.1016/j.chb.2015.04.024,884,2015,Understanding mobile banking: The unified theory of acceptance and use of technology combined with cultural moderators,0,FALSE
10.1086/511995,877,2007,The Effect of File Sharing on Record Sales: An Empirical Analysis,1,TRUE
10.1037/0022-3514.67.4.627,875,1994,Role of consciousness and accessibility of death-related thoughts in mortality salience effects.,1,TRUE
10.1073/pnas.251541498,875,2001,Can race be erased? Coalitional computation and social categorization,5,TRUE
10.1177/000312240406900501,857,2004,Are Schools the Great Equalizer? Cognitive Inequality during the Summer Months and the School Year,1,TRUE
10.1073/pnas.1009906107,852,2010,Commensal bacteria play a role in mating preference of <i>Drosophila melanogaster</i>,4,TRUE
10.1177/0956797610383437,850,2010,Power Posing,2,TRUE
10.1257/aer.101.2.470,850,2011,Reference Points and Effort Provision,1,TRUE
10.1177/1754073908100432,848,2009,Remembering the Details: Effects of Emotion,3,TRUE
10.1152/japplphysiol.01095.2004,848,2005,Six sessions of sprint interval training increases muscle oxidative potential and cycle endurance capacity in humans,0,FALSE
10.1111/j.0956-7976.2004.00757.x,843,2004,Effort for Payment,2,TRUE
10.1037/0022-3514.94.4.672,839,2008,On the relative independence of thinking biases and cognitive ability.,0,FALSE
10.1016/j.aos.2007.01.001,839,2007,An empirical analysis of the levers of control framework,0,FALSE
10.2307/1386523,839,1995,Risk and Religion: An Explanation of Gender Differences in Religiosity,0,FALSE
10.1111/1467-9280.00334,837,2001,"Money, Kisses, and Electric Shocks: On the Affective Psychology of Risk",1,TRUE
10.1126/scitranslmed.3001318,830,2011,Discovery and Preclinical Validation of Drug Indications Using Compendia of Public Gene Expression Data,0,FALSE
10.1037/0096-3445.136.4.569,828,2007,Overcoming intuition: Metacognitive difficulty activates analytic reasoning.,1,TRUE
